PMID,Title,Authors,Citation,First Author,Journal/Book,Publication Year,Create Date,PMCID,NIHMS ID,DOI,Label
26101260,echo-livefish: in vivo rna labeling reveals dynamic regulation of nuclear rna foci in living tissues,"Oomoto I, Suzuki-Hirano A, Umeshima H, Han YW, Yanagisawa H, Carlton P, Harada Y, Kengaku M, Okamoto A, Shimogori T, Wang DO.",Nucleic Acids Res. 2015 Oct 30;43(19):e126. doi: 10.1093/nar/gkv614. Epub 2015 Jun 22.,Oomoto I,Nucleic Acids Res,2015,2015/06/24,PMC4627062,,10.1093/nar/gkv614,0
28922636,effects of mutations on active site conformation and dynamics of rna-dependent rna polymerase from coxsackievirus b3,"Shen H, Deng M, Zhang Y.",J Mol Graph Model. 2017 Oct;77:330-337. doi: 10.1016/j.jmgm.2017.09.008. Epub 2017 Sep 12.,Shen H,J Mol Graph Model,2017,2017/09/19,,,10.1016/j.jmgm.2017.09.008,0
15523706,"joint modelling of bivariate longitudinal data with informative dropout and left-censoring, with application to the evolution of cd4+ cell count and hiv rna viral load in response to treatment of hiv infection","Thiébaut R, Jacqmin-Gadda H, Babiker A, Commenges D; CASCADE Collaboration.",Stat Med. 2005 Jan 15;24(1):65-82. doi: 10.1002/sim.1923.,Thiébaut R,Stat Med,2005,2004/11/04,,,10.1002/sim.1923,0
20507916,molecular dynamics simulations suggest that rna three-way junctions can act as flexible rna structural elements in the ribosome,"Besseová I, Réblová K, Leontis NB, Sponer J.",Nucleic Acids Res. 2010 Oct;38(18):6247-64. doi: 10.1093/nar/gkq414. Epub 2010 May 27.,Besseová I,Nucleic Acids Res,2010,2010/05/29,PMC2952862,,10.1093/nar/gkq414,0
19910183,dynamics: the missing link between structure and function of the viral rna-dependent rna polymerase?,"Cameron CE, Moustafa IM, Arnold JJ.",Curr Opin Struct Biol. 2009 Dec;19(6):768-74. doi: 10.1016/j.sbi.2009.10.012. Epub 2009 Nov 10.,Cameron CE,Curr Opin Struct Biol,2009,2009/11/14,PMC2787719,NIHMS156297,10.1016/j.sbi.2009.10.012,0
33230257,gene expression dynamics during rapid organismal diversification in african cichlid fishes,"El Taher A, Böhne A, Boileau N, Ronco F, Indermaur A, Widmer L, Salzburger W.",Nat Ecol Evol. 2021 Feb;5(2):243-250. doi: 10.1038/s41559-020-01354-3. Epub 2020 Nov 23.,El Taher A,Nat Ecol Evol,2021,2020/11/24,PMC7610457,EMS118322,10.1038/s41559-020-01354-3,0
32714375,stochastic dynamics of gene switching and energy dissipation for gene expression,"Liu Q, Yu F, Yi L, Gao Y, Gui R, Yi M, Sun J.",Front Genet. 2020 Jul 2;11:676. doi: 10.3389/fgene.2020.00676. eCollection 2020.,Liu Q,Front Genet,2020,2020/07/28,PMC7343763,,10.3389/fgene.2020.00676,0
30649296,restructured geo: restructuring gene expression omnibus metadata for genome dynamics analysis,"Chen G, Ramírez JC, Deng N, Qiu X, Wu C, Zheng WJ, Wu H.",Database (Oxford). 2019 Jan 1;2019:bay145. doi: 10.1093/database/bay145.,Chen G,Database (Oxford),2019,2019/01/17,PMC6333964,,10.1093/database/bay145,0
23754949,impact of natural genetic variation on gene expression dynamics,"Ackermann M, Sikora-Wohlfeld W, Beyer A.",PLoS Genet. 2013 Jun;9(6):e1003514. doi: 10.1371/journal.pgen.1003514. Epub 2013 Jun 6.,Ackermann M,PLoS Genet,2013,2013/06/12,PMC3674999,,10.1371/journal.pgen.1003514,0
23669271,early signatures of regime shifts in gene expression dynamics,"Pal M, Pal AK, Ghosh S, Bose I.",Phys Biol. 2013 Jun;10(3):036010. doi: 10.1088/1478-3975/10/3/036010. Epub 2013 May 13.,Pal M,Phys Biol,2013,2013/05/15,,,10.1088/1478-3975/10/3/036010,0
35081348,myc amplifies gene expression through global changes in transcription factor dynamics,"Patange S, Ball DA, Wan Y, Karpova TS, Girvan M, Levens D, Larson DR.",Cell Rep. 2022 Jan 25;38(4):110292. doi: 10.1016/j.celrep.2021.110292.,Patange S,Cell Rep,2022,2022/01/26,PMC8849550,NIHMS1774139,10.1016/j.celrep.2021.110292,0
34867890,real-time messenger rna dynamics in bacillus subtilis,"Sattler L, Graumann PL.",Front Microbiol. 2021 Nov 18;12:760857. doi: 10.3389/fmicb.2021.760857. eCollection 2021.,Sattler L,Front Microbiol,2021,2021/12/06,PMC8637298,,10.3389/fmicb.2021.760857,0
33514943,revealing nascent rna processing dynamics with nano-cop,"Drexler HL, Choquet K, Merens HE, Tang PS, Simpson JT, Churchman LS.",Nat Protoc. 2021 Mar;16(3):1343-1375. doi: 10.1038/s41596-020-00469-y. Epub 2021 Jan 29.,Drexler HL,Nat Protoc,2021,2021/01/30,PMC8713461,NIHMS1765166,10.1038/s41596-020-00469-y,0
31649059,identification and dynamic quantification of regulatory elements using total rna,"Duttke SH, Chang MW, Heinz S, Benner C.",Genome Res. 2019 Nov;29(11):1836-1846. doi: 10.1101/gr.253492.119. Epub 2019 Oct 24.,Duttke SH,Genome Res,2019,2019/10/26,PMC6836739,,10.1101/gr.253492.119,0
27249342,recent advances in dynamic m6a rna modification,"Cao G, Li HB, Yin Z, Flavell RA.",Open Biol. 2016 Apr;6(4):160003. doi: 10.1098/rsob.160003. Epub 2016 Apr 13.,Cao G,Open Biol,2016,2016/06/02,PMC4852458,,10.1098/rsob.160003,0
24762118,dynamical transition and heterogeneous hydration dynamics in rna,"Yoon J, Lin JC, Hyeon C, Thirumalai D.",J Phys Chem B. 2014 Jul 17;118(28):7910-9. doi: 10.1021/jp500643u. Epub 2014 May 7.,Yoon J,J Phys Chem B,2014,2014/04/26,,,10.1021/jp500643u,0
33188777,translation and replication dynamics of single rna viruses,"Boersma S, Rabouw HH, Bruurs LJM, Pavlovič T, van Vliet ALW, Beumer J, Clevers H, van Kuppeveld FJM, Tanenbaum ME.",Cell. 2020 Dec 23;183(7):1930-1945.e23. doi: 10.1016/j.cell.2020.10.019. Epub 2020 Nov 13.,Boersma S,Cell,2020,2020/11/14,PMC7664544,,10.1016/j.cell.2020.10.019,0
29654887,emerging role of dynamic rna modifications during animal development,"Sánchez-Vásquez E, Alata Jimenez N, Vázquez NA, Strobl-Mazzulla PH.",Mech Dev. 2018 Dec;154:24-32. doi: 10.1016/j.mod.2018.04.002. Epub 2018 Apr 11.,Sánchez-Vásquez E,Mech Dev,2018,2018/04/15,,,10.1016/j.mod.2018.04.002,0
28449301,the profile and dynamics of rna modifications in animals,"van Delft P, Akay A, Huber SM, Bueschl C, Rudolph KLM, Di Domenico T, Schuhmacher R, Miska EA, Balasubramanian S.",Chembiochem. 2017 Jun 1;18(11):979-984. doi: 10.1002/cbic.201700093. Epub 2017 Apr 27.,van Delft P,Chembiochem,2017,2017/04/28,PMC5784800,EMS75864,10.1002/cbic.201700093,0
25208764,modeling of rna nanotubes using molecular dynamics simulation,"Badu SR, Melnik R, Paliy M, Prabhakar S, Sebetci A, Shapiro BA.",Eur Biophys J. 2014 Nov;43(10-11):555-64. doi: 10.1007/s00249-014-0985-6. Epub 2014 Sep 12.,Badu SR,Eur Biophys J,2014,2014/09/12,PMC6345520,NIHMS1003702,10.1007/s00249-014-0985-6,0
17259992,rna polymerase i in yeast transcribes dynamic nucleosomal rdna,"Jones HS, Kawauchi J, Braglia P, Alen CM, Kent NA, Proudfoot NJ.",Nat Struct Mol Biol. 2007 Feb;14(2):123-30. doi: 10.1038/nsmb1199. Epub 2007 Jan 28.,Jones HS,Nat Struct Mol Biol,2007,2007/01/30,PMC6941936,EMS85340,10.1038/nsmb1199,0
32989247,mitochondrial rna granules are fluid condensates positioned by membrane dynamics,"Rey T, Zaganelli S, Cuillery E, Vartholomaiou E, Croisier M, Martinou JC, Manley S.",Nat Cell Biol. 2020 Oct;22(10):1180-1186. doi: 10.1038/s41556-020-00584-8. Epub 2020 Sep 28.,Rey T,Nat Cell Biol,2020,2020/09/29,PMC7610405,EMS118422,10.1038/s41556-020-00584-8,0
17373794,direct revelation of multiple conformations in rna by femtosecond dynamics,"Zhao L, Xia T.",J Am Chem Soc. 2007 Apr 11;129(14):4118-9. doi: 10.1021/ja068391q. Epub 2007 Mar 21.,Zhao L,J Am Chem Soc,2007,2007/03/22,,,10.1021/ja068391q,0
22946509,a dynamic fret reporter of gene expression improved by functional screening,"Schifferer M, Griesbeck O.",J Am Chem Soc. 2012 Sep 19;134(37):15185-8. doi: 10.1021/ja3055673. Epub 2012 Sep 10.,Schifferer M,J Am Chem Soc,2012,2012/09/06,,,10.1021/ja3055673,0
12193569,calcium dynamics and resting transcriptional activity regulates prolactin gene expression,"Villalobos C, Núñez L, Faught WJ, Leaumont DC, Boockfor FR, Frawley LS.",Endocrinology. 2002 Sep;143(9):3548-54. doi: 10.1210/en.2002-220266.,Villalobos C,Endocrinology,2002,2002/08/24,,,10.1210/en.2002-220266,0
31618721,constraining the complexity of promoter dynamics using fluctuations in gene expression,"Kumar N, Kulkarni RV.",Phys Biol. 2019 Nov 5;17(1):015001. doi: 10.1088/1478-3975/ab4e57.,Kumar N,Phys Biol,2019,2019/10/17,PMC8011943,NIHMS1683428,10.1088/1478-3975/ab4e57,0
27957492,effect of dynamic interaction between microrna and transcription factor on gene expression,"Zhao Q, Liu H, Yao C, Shuai J, Sun X.",Biomed Res Int. 2016;2016:2676282. doi: 10.1155/2016/2676282. Epub 2016 Nov 10.,Zhao Q,Biomed Res Int,2016,2016/12/14,PMC5121577,,10.1155/2016/2676282,0
16384104,coupled dynamics of rna folding and nanopore translocation,"Bundschuh R, Gerland U.",Phys Rev Lett. 2005 Nov 11;95(20):208104. doi: 10.1103/PhysRevLett.95.208104. Epub 2005 Nov 10.,Bundschuh R,Phys Rev Lett,2005,2005/12/31,,,10.1103/PhysRevLett.95.208104,0
33766521,cohesin: behind dynamic genome topology and gene expression reprogramming,"Perea-Resa C, Wattendorf L, Marzouk S, Blower MD.",Trends Cell Biol. 2021 Sep;31(9):760-773. doi: 10.1016/j.tcb.2021.03.005. Epub 2021 Mar 22.,Perea-Resa C,Trends Cell Biol,2021,2021/03/26,PMC8364472,NIHMS1683209,10.1016/j.tcb.2021.03.005,0
32421815,gene expression dynamics are a proxy for selective pressures on alternatively polyadenylated isoforms,"Levin M, Zalts H, Mostov N, Hashimshony T, Yanai I.",Nucleic Acids Res. 2020 Jun 19;48(11):5926-5938. doi: 10.1093/nar/gkaa359.,Levin M,Nucleic Acids Res,2020,2020/05/19,PMC7293032,,10.1093/nar/gkaa359,0
27857972,regulation of gene expression and mitochondrial dynamics by smad,"Shah N, Lee NY.",Mol Cell Oncol. 2016 Jun 30;3(5):e1204492. doi: 10.1080/23723556.2016.1204492. eCollection 2016.,Shah N,Mol Cell Oncol,2016,2016/11/19,PMC5068171,,10.1080/23723556.2016.1204492,0
23349679,chemical memory reactions induced bursting dynamics in gene expression,Tian T.,PLoS One. 2013;8(1):e52029. doi: 10.1371/journal.pone.0052029. Epub 2013 Jan 21.,Tian T,PLoS One,2013,2013/01/26,PMC3549921,,10.1371/journal.pone.0052029,0
23142668,effects of gene length on the dynamics of gene expression,"Ribeiro AS, Häkkinen A, Lloyd-Price J.",Comput Biol Chem. 2012 Dec;41:1-9. doi: 10.1016/j.compbiolchem.2012.10.002. Epub 2012 Oct 22.,Ribeiro AS,Comput Biol Chem,2012,2012/11/13,,,10.1016/j.compbiolchem.2012.10.002,0
21842360,is transcription the dominant force during dynamic changes in gene expression?,Turner M.,Adv Exp Med Biol. 2011;780:1-13. doi: 10.1007/978-1-4419-5632-3_1.,Turner M,Adv Exp Med Biol,2011,2011/08/16,,,10.1007/978-1-4419-5632-3_1,0
20703317,'candidatus accumulibacter' gene expression in response to dynamic ebpr conditions,"He S, McMahon KD.",ISME J. 2011 Feb;5(2):329-40. doi: 10.1038/ismej.2010.127. Epub 2010 Aug 12.,He S,ISME J,2011,2010/08/13,PMC3105699,,10.1038/ismej.2010.127,0
34837346,structural and dynamic studies of the human rna binding protein rbm3 reveals the molecular basis of its oligomerization and rna recognition,"Roy S, Boral S, Maiti S, Kushwaha T, Basak AJ, Lee W, Basak A, Gholap SL, Inampudi KK, De S.",FEBS J. 2021 Nov 27. doi: 10.1111/febs.16301. Online ahead of print.,Roy S,FEBS J,2021,2021/11/27,,,10.1111/febs.16301,0
34672536,single-neuron rna modification analysis by mass spectrometry: characterizing rna modification patterns and dynamics with single-cell resolution,"Clark KD, Rubakhin SS, Sweedler JV.",Anal Chem. 2021 Nov 2;93(43):14537-14544. doi: 10.1021/acs.analchem.1c03507. Epub 2021 Oct 21.,Clark KD,Anal Chem,2021,2021/10/21,PMC8608286,NIHMS1751884,10.1021/acs.analchem.1c03507,0
15839703,recognition of rna by amide modified backbone nucleic acids: molecular dynamics simulations of dna-rna hybrids in aqueous solution,"Nina M, Fonné-Pfister R, Beaudegnies R, Chekatt H, Jung PM, Murphy-Kessabi F, De Mesmaeker A, Wendeborn S.",J Am Chem Soc. 2005 Apr 27;127(16):6027-38. doi: 10.1021/ja0486566.,Nina M,J Am Chem Soc,2005,2005/04/21,,,10.1021/ja0486566,0
12475232,electron paramagnetic resonance dynamic signatures of tar rna-small molecule complexes provide insight into rna structure and recognition,"Edwards TE, Sigurdsson ST.",Biochemistry. 2002 Dec 17;41(50):14843-7. doi: 10.1021/bi026299a.,Edwards TE,Biochemistry,2002,2002/12/12,,,10.1021/bi026299a,0
35037043,crystal structures of alphavirus nonstructural protein 4 (nsp4) reveal an intrinsically dynamic rna-dependent rna polymerase fold,"Tan YB, Lello LS, Liu X, Law YS, Kang C, Lescar J, Zheng J, Merits A, Luo D.",Nucleic Acids Res. 2022 Jan 25;50(2):1000-1016. doi: 10.1093/nar/gkab1302.,Tan YB,Nucleic Acids Res,2022,2022/01/17,PMC8789068,,10.1093/nar/gkab1302,0
34694511,emergent correlations in gene expression dynamics as footprints of resource competition,"Chakraborty P, Ghosh S.",Eur Phys J E Soft Matter. 2021 Oct 25;44(10):131. doi: 10.1140/epje/s10189-021-00122-w.,Chakraborty P,Eur Phys J E Soft Matter,2021,2021/10/25,,,10.1140/epje/s10189-021-00122-w,0
34369376,cis-regulatory variants affect gene expression dynamics in yeast,"Shih CH, Fay J.",Elife. 2021 Aug 9;10:e68469. doi: 10.7554/eLife.68469.,Shih CH,Elife,2021,2021/08/09,PMC8367379,,10.7554/eLife.68469,0
30403187,exploring the dynamic changes between pulmonary and cutaneous sarcoidosis based on gene expression,"Sheng Y, Yang Y, Wu Y, Yang Q.",Med Sci (Paris). 2018 Oct;34 Focus issue F1:121-133. doi: 10.1051/medsci/201834f121. Epub 2018 Nov 7.,Sheng Y,Med Sci (Paris),2018,2018/11/08,,,10.1051/medsci/201834f121,0
26081144,kisspeptin induces dynamic chromatin modifications to control gnrh gene expression,"Novaira HJ, Sonko ML, Radovick S.",Mol Neurobiol. 2016 Jul;53(5):3315-3325. doi: 10.1007/s12035-015-9269-0. Epub 2015 Jun 17.,Novaira HJ,Mol Neurobiol,2016,2015/06/18,,,10.1007/s12035-015-9269-0,0
22102826,"consequences of eukaryotic enhancer architecture for gene expression dynamics, development, and fitness","Ludwig MZ, Manu, Kittler R, White KP, Kreitman M.",PLoS Genet. 2011 Nov;7(11):e1002364. doi: 10.1371/journal.pgen.1002364. Epub 2011 Nov 10.,Ludwig MZ,PLoS Genet,2011,2011/11/22,PMC3213169,,10.1371/journal.pgen.1002364,0
24489123,curli synthesis and biofilm formation in enteric bacteria are controlled by a dynamic small rna module made up of a pseudoknot assisted by an rna chaperone,"Bordeau V, Felden B.",Nucleic Acids Res. 2014 Apr;42(7):4682-96. doi: 10.1093/nar/gku098. Epub 2014 Feb 1.,Bordeau V,Nucleic Acids Res,2014,2014/02/04,PMC3985669,,10.1093/nar/gku098,0
31063878,dynamic gene expression engineering as a tool in pathway engineering,"Shen X, Wang J, Li C, Yuan Q, Yan Y.",Curr Opin Biotechnol. 2019 Oct;59:122-129. doi: 10.1016/j.copbio.2019.03.019. Epub 2019 May 4.,Shen X,Curr Opin Biotechnol,2019,2019/05/08,,,10.1016/j.copbio.2019.03.019,0
30944353,g-quadruplex dynamics contribute to regulation of mitochondrial gene expression,"Falabella M, Kolesar JE, Wallace C, de Jesus D, Sun L, Taguchi YV, Wang C, Wang T, Xiang IM, Alder JK, Maheshan R, Horne W, Turek-Herman J, Pagano PJ, St Croix CM, Sondheimer N, Yatsunyk LA, Johnson FB, Kaufman BA.",Sci Rep. 2019 Apr 3;9(1):5605. doi: 10.1038/s41598-019-41464-y.,Falabella M,Sci Rep,2019,2019/04/05,PMC6447596,,10.1038/s41598-019-41464-y,0
17155441,linking stochastic dynamics to population distribution: an analytical framework of gene expression,"Friedman N, Cai L, Xie XS.",Phys Rev Lett. 2006 Oct 20;97(16):168302. doi: 10.1103/PhysRevLett.97.168302. Epub 2006 Oct 19.,Friedman N,Phys Rev Lett,2006,2006/12/13,,,10.1103/PhysRevLett.97.168302,0
12727636,gene expression dynamics during germinal center transit in b cells,"Klein U, Tu Y, Stolovitzky GA, Keller JL, Haddad J Jr, Miljkovic V, Cattoretti G, Califano A, Dalla-Favera R.",Ann N Y Acad Sci. 2003 Apr;987:166-72. doi: 10.1111/j.1749-6632.2003.tb06045.x.,Klein U,Ann N Y Acad Sci,2003,2003/05/03,,,10.1111/j.1749-6632.2003.tb06045.x,0
34775600,dynamic intron retention modulates gene expression in the monocytic differentiation pathway,"Song R, Tikoo S, Jain R, Pinello N, Au AYM, Nagarajah R, Porse B, Rasko JEJ, J-L Wong J.",Immunology. 2022 Feb;165(2):274-286. doi: 10.1111/imm.13435. Epub 2021 Dec 12.,Song R,Immunology,2022,2021/11/14,,,10.1111/imm.13435,0
29375398,dynamic changes in chemosensory gene expression during the dendrolimus punctatus mating process,"Zhang SF, Zhang Z, Kong XB, Wang HB, Liu F.",Front Physiol. 2018 Jan 10;8:1127. doi: 10.3389/fphys.2017.01127. eCollection 2017.,Zhang SF,Front Physiol,2018,2018/01/30,PMC5767605,,10.3389/fphys.2017.01127,0
29149479,crispr-cas expands dynamic range of gene expression from t7rnap promoters,"McCutcheon SR, Chiu KL, Lewis DD, Tan C.",Biotechnol J. 2018 May;13(5):e1700167. doi: 10.1002/biot.201700167. Epub 2017 Dec 6.,McCutcheon SR,Biotechnol J,2018,2017/11/18,,,10.1002/biot.201700167,0
28950646,regime shifts driven by dynamic correlations in gene expression noise,"Sharma Y, Dutta PS.",Phys Rev E. 2017 Aug;96(2-1):022409. doi: 10.1103/PhysRevE.96.022409. Epub 2017 Aug 18.,Sharma Y,Phys Rev E,2017,2017/09/28,,,10.1103/PhysRevE.96.022409,0
22032193,transcriptional repressors: shutting off gene expression at the source affects developmental dynamics,Arnosti DN.,Curr Biol. 2011 Oct 25;21(20):R859-60. doi: 10.1016/j.cub.2011.09.022.,Arnosti DN,Curr Biol,2011,2011/10/29,,,10.1016/j.cub.2011.09.022,0
21718109,dynamic changes in epigenetic marks and gene expression during porcine epiblast specification,"Gao Y, Hyttel P, Hall VJ.",Cell Reprogram. 2011 Aug;13(4):345-60. doi: 10.1089/cell.2010.0110. Epub 2011 Jun 30.,Gao Y,Cell Reprogram,2011,2011/07/02,,,10.1089/cell.2010.0110,0
33834762,dynamic control of gene expression with riboregulated switchable feedback promoters,"Glasscock CJ, Biggs BW, Lazar JT, Arnold JH, Burdette LA, Valdes A, Kang MK, Tullman-Ercek D, Tyo KEJ, Lucks JB.",ACS Synth Biol. 2021 May 21;10(5):1199-1213. doi: 10.1021/acssynbio.1c00015. Epub 2021 Apr 9.,Glasscock CJ,ACS Synth Biol,2021,2021/04/09,PMC8141045,NIHMS1696552,10.1021/acssynbio.1c00015,0
28404748,components of rna granules affect their localization and dynamics in neuronal dendrites,"Mitsumori K, Takei Y, Hirokawa N.",Mol Biol Cell. 2017 Jun 1;28(11):1412-1417. doi: 10.1091/mbc.E16-07-0497. Epub 2017 Apr 12.,Mitsumori K,Mol Biol Cell,2017,2017/04/14,PMC5449141,,10.1091/mbc.E16-07-0497,0
27256384,rna dynamics in the control of circadian rhythm,"Benegiamo G, Brown SA, Panda S.",Adv Exp Med Biol. 2016;907:107-22. doi: 10.1007/978-3-319-29073-7_5.,Benegiamo G,Adv Exp Med Biol,2016,2016/06/04,,,10.1007/978-3-319-29073-7_5,0
26082675,stacking in rna: nmr of four tetramers benchmark molecular dynamics,"Condon DE, Kennedy SD, Mort BC, Kierzek R, Yildirim I, Turner DH.",J Chem Theory Comput. 2015 Jun 9;11(6):2729-2742. doi: 10.1021/ct501025q. Epub 2015 Apr 16.,Condon DE,J Chem Theory Comput,2015,2015/06/18,PMC4463549,,10.1021/ct501025q,0
26046441,widespread co-translational rna decay reveals ribosome dynamics,"Pelechano V, Wei W, Steinmetz LM.",Cell. 2015 Jun 4;161(6):1400-12. doi: 10.1016/j.cell.2015.05.008.,Pelechano V,Cell,2015,2015/06/06,PMC4461875,NIHMS688997,10.1016/j.cell.2015.05.008,0
22516180,dynamics in multi-domain protein recognition of rna,"Mackereth CD, Sattler M.",Curr Opin Struct Biol. 2012 Jun;22(3):287-96. doi: 10.1016/j.sbi.2012.03.013. Epub 2012 Apr 18.,Mackereth CD,Curr Opin Struct Biol,2012,2012/04/21,,,10.1016/j.sbi.2012.03.013,0
21593583,dynamic rna structures in the dengue virus genome,"Iglesias NG, Gamarnik AV.",RNA Biol. 2011 Mar-Apr;8(2):249-57. doi: 10.4161/rna.8.2.14992. Epub 2011 Mar 1.,Iglesias NG,RNA Biol,2011,2011/05/20,,,10.4161/rna.8.2.14992,0
18824128,taking femtosecond snapshots of rna conformational dynamics and complexity,Xia T.,Curr Opin Chem Biol. 2008 Dec;12(6):604-11. doi: 10.1016/j.cbpa.2008.08.033. Epub 2008 Sep 25.,Xia T,Curr Opin Chem Biol,2008,2008/10/01,,,10.1016/j.cbpa.2008.08.033,0
18047338,dynamics of large elongated rna by nmr carbon relaxation,"Hansen AL, Al-Hashimi HM.",J Am Chem Soc. 2007 Dec 26;129(51):16072-82. doi: 10.1021/ja0757982. Epub 2007 Nov 30.,Hansen AL,J Am Chem Soc,2007,2007/12/01,,,10.1021/ja0757982,0
11105748,coupled nucleotide covariations reveal dynamic rna interaction patterns,"Gultyaev AP, Franch T, Gerdes K.",RNA. 2000 Nov;6(11):1483-91. doi: 10.1017/s1355838200990708.,Gultyaev AP,RNA,2000,2000/12/06,PMC1370018,,10.1017/s1355838200990708,0
29222116,our views of dynamic n(6)-methyladenosine rna methylation,"Zhao BS, Nachtergaele S, Roundtree IA, He C.",RNA. 2018 Mar;24(3):268-272. doi: 10.1261/rna.064295.117. Epub 2017 Dec 8.,Zhao BS,RNA,2018,2017/12/10,PMC5824347,,10.1261/rna.064295.117,0
27071649,"saxs studies of rna: structures, dynamics, and interactions with partners","Chen Y, Pollack L.",Wiley Interdiscip Rev RNA. 2016 Jul;7(4):512-26. doi: 10.1002/wrna.1349. Epub 2016 Apr 12.,Chen Y,Wiley Interdiscip Rev RNA,2016,2016/04/14,PMC4909577,NIHMS768254,10.1002/wrna.1349,0
26803450,rna editing: a contributor to neuronal dynamics in the mammalian brain,"Behm M, Öhman M.",Trends Genet. 2016 Mar;32(3):165-175. doi: 10.1016/j.tig.2015.12.005. Epub 2016 Jan 20.,Behm M,Trends Genet,2016,2016/01/25,,,10.1016/j.tig.2015.12.005,0
21710567,the dynamic protein partnership of rna polymerase in bacillus subtilis,"Delumeau O, Lecointe F, Muntel J, Guillot A, Guédon E, Monnet V, Hecker M, Becher D, Polard P, Noirot P.",Proteomics. 2011 Aug;11(15):2992-3001. doi: 10.1002/pmic.201000790. Epub 2011 Jun 28.,Delumeau O,Proteomics,2011,2011/06/29,,,10.1002/pmic.201000790,0
18539024,"structure, dynamics, and function of rna modification enzymes","Ishitani R, Yokoyama S, Nureki O.",Curr Opin Struct Biol. 2008 Jun;18(3):330-9. doi: 10.1016/j.sbi.2008.05.003. Epub 2008 Jun 5.,Ishitani R,Curr Opin Struct Biol,2008,2008/06/10,,,10.1016/j.sbi.2008.05.003,0
10984406,comparison of molecular dynamics and harmonic mode calculations on rna,Zacharias M.,Biopolymers. 2000 Dec;54(7):547-60. doi: 10.1002/1097-0282(200012)54:7<547::AID-BIP70>3.0.CO;2-N.,Zacharias M,Biopolymers,2000,2000/09/13,,,10.1002/1097-0282(200012)54:7<547::AID-BIP70>3.0.CO;2-N,0
24522531,protein-guided rna dynamics during early ribosome assembly,"Kim H, Abeysirigunawarden SC, Chen K, Mayerle M, Ragunathan K, Luthey-Schulten Z, Ha T, Woodson SA.",Nature. 2014 Feb 20;506(7488):334-8. doi: 10.1038/nature13039. Epub 2014 Feb 12.,Kim H,Nature,2014,2014/02/14,PMC3968076,NIHMS558374,10.1038/nature13039,0
19404252,imaging intracellular rna distribution and dynamics in living cells,Tyagi S.,Nat Methods. 2009 May;6(5):331-8. doi: 10.1038/nmeth.1321.,Tyagi S,Nat Methods,2009,2009/05/01,,,10.1038/nmeth.1321,0
31735514,nuclear actin dynamics in gene expression and genome organization,"Kyheröinen S, Vartiainen MK.",Semin Cell Dev Biol. 2020 Jun;102:105-112. doi: 10.1016/j.semcdb.2019.10.012. Epub 2019 Nov 15.,Kyheröinen S,Semin Cell Dev Biol,2020,2019/11/19,,,10.1016/j.semcdb.2019.10.012,0
28513996,conformational dynamics of mrna in gene expression as new pharmaceutical target,"Endoh T, Sugimoto N.",Chem Rec. 2017 Sep;17(9):817-832. doi: 10.1002/tcr.201700016. Epub 2017 May 17.,Endoh T,Chem Rec,2017,2017/05/18,,,10.1002/tcr.201700016,0
27320128,gene expression: dynamic enhancer-promoter interactions for transcriptional bursting,Cloney R.,Nat Rev Genet. 2016 Aug;17(8):437. doi: 10.1038/nrg.2016.81. Epub 2016 Jun 20.,Cloney R,Nat Rev Genet,2016,2016/06/21,,,10.1038/nrg.2016.81,0
26467206,dynamic association rules for gene expression data analysis,"Chen SC, Tsai TH, Chung CH, Li WH.",BMC Genomics. 2015 Oct 14;16:786. doi: 10.1186/s12864-015-1970-x.,Chen SC,BMC Genomics,2015,2015/10/16,PMC4606551,,10.1186/s12864-015-1970-x,0
16681847,applying dynamic bayesian networks to perturbed gene expression data,"Dojer N, Gambin A, Mizera A, Wilczyński B, Tiuryn J.",BMC Bioinformatics. 2006 May 8;7:249. doi: 10.1186/1471-2105-7-249.,Dojer N,BMC Bioinformatics,2006,2006/05/10,PMC1513402,,10.1186/1471-2105-7-249,0
30720274,dna transformer for visualizing endogenous rna dynamics in live cells,"Wan Y, Zhu N, Lu Y, Wong PK.",Anal Chem. 2019 Feb 19;91(4):2626-2633. doi: 10.1021/acs.analchem.8b02826. Epub 2019 Feb 5.,Wan Y,Anal Chem,2019,2019/02/06,,,10.1021/acs.analchem.8b02826,0
29942805,are amyloid fibrils rna-traps? a molecular dynamics perspective,"Meli M, Gasset M, Colombo G.",Front Mol Biosci. 2018 Jun 11;5:53. doi: 10.3389/fmolb.2018.00053. eCollection 2018.,Meli M,Front Mol Biosci,2018,2018/06/27,PMC6004406,,10.3389/fmolb.2018.00053,0
23525495,ph-dependent dynamics of complex rna macromolecules,"Goh GB, Knight JL, Brooks CL 3rd.",J Chem Theory Comput. 2013 Feb 12;9(2):935-943. doi: 10.1021/ct300942z. Epub 2013 Jan 3.,Goh GB,J Chem Theory Comput,2013,2013/03/26,PMC3601751,NIHMS433459,10.1021/ct300942z,0
22315070,functional dynamics of rna ribozymes studied by nmr spectroscopy,"Fürtig B, Buck J, Richter C, Schwalbe H.",Methods Mol Biol. 2012;848:185-99. doi: 10.1007/978-1-61779-545-9_12.,Fürtig B,Methods Mol Biol,2012,2012/02/09,,,10.1007/978-1-61779-545-9_12,0
21678902,the dynamic nature of rna as key to understanding riboswitch mechanisms,"Haller A, Soulière MF, Micura R.",Acc Chem Res. 2011 Dec 20;44(12):1339-48. doi: 10.1021/ar200035g. Epub 2011 Jun 16.,Haller A,Acc Chem Res,2011,2011/06/18,,,10.1021/ar200035g,0
21121025,quantifying slow evolutionary dynamics in rna fitness landscapes,"Sulc P, Wagner A, Martin OC.",J Bioinform Comput Biol. 2010 Dec;8(6):1027-40. doi: 10.1142/s0219720010005075.,Sulc P,J Bioinform Comput Biol,2010,2010/12/02,,,10.1142/s0219720010005075,0
20577037,coarse-graining rna nanostructures for molecular dynamics simulations,"Paliy M, Melnik R, Shapiro BA.",Phys Biol. 2010 Jun 24;7(3):036001. doi: 10.1088/1478-3975/7/3/036001.,Paliy M,Phys Biol,2010,2010/06/26,PMC3767480,NIHMS492008,10.1088/1478-3975/7/3/036001,0
15890929,dynamics of viral rna synthesis during measles virus infection,"Plumet S, Duprex WP, Gerlier D.",J Virol. 2005 Jun;79(11):6900-8. doi: 10.1128/JVI.79.11.6900-6908.2005.,Plumet S,J Virol,2005,2005/05/14,PMC1112129,,10.1128/JVI.79.11.6900-6908.2005,0
