PMID,Title,Authors,Citation,First Author,Journal/Book,Publication Year,Create Date,PMCID,NIHMS ID,DOI,Label
16729059,monitoring dynamics of single-cell gene expression over multiple cell cycles,"Cookson S, Ostroff N, Pang WL, Volfson D, Hasty J.",Mol Syst Biol. 2005;1:2005.0024. doi: 10.1038/msb4100032. Epub 2005 Nov 22.,Cookson S,Mol Syst Biol,2005,2006/05/27,PMC1681470,,10.1038/msb4100032,1
20726793,wavelet-based functional clustering for patterns of high-dimensional dynamic gene expression,"Kim BR, McMurry T, Zhao W, Wu R, Berg A.",J Comput Biol. 2010 Aug;17(8):1067-80. doi: 10.1089/cmb.2009.0270.,Kim BR,J Comput Biol,2010,2010/08/24,PMC3133835,,10.1089/cmb.2009.0270,1
34012074,publisher correction: single-cell transcriptomic analysis of somatosensory neurons uncovers temporal development of neuropathic pain,"Wang K, Wang S, Chen Y, Wu D, Hu X, Lu Y, Wang L, Bao L, Li C, Zhang X.",Cell Res. 2021 Aug;31(8):939-940. doi: 10.1038/s41422-021-00503-y.,Wang K,Cell Res,2021,2021/05/20,PMC8324829,,10.1038/s41422-021-00503-y,1
32433953,single-cell rna sequencing reveals a dynamic stromal niche that supports tumor growth,"Davidson S, Efremova M, Riedel A, Mahata B, Pramanik J, Huuhtanen J, Kar G, Vento-Tormo R, Hagai T, Chen X, Haniffa MA, Shields JD, Teichmann SA.",Cell Rep. 2020 May 19;31(7):107628. doi: 10.1016/j.celrep.2020.107628.,Davidson S,Cell Rep,2020,2020/05/21,PMC7242909,EMS86335,10.1016/j.celrep.2020.107628,1
29851136,gene expression dynamics following mithramycin treatment: a possible model for post-chemotherapy cognitive impairment,"Asor E, Ben-Shachar D.",Clin Exp Pharmacol Physiol. 2018 Oct;45(10):1028-1037. doi: 10.1111/1440-1681.12975. Epub 2018 Jul 11.,Asor E,Clin Exp Pharmacol Physiol,2018,2018/06/01,,,10.1111/1440-1681.12975,1
24867692,chemotherapy-induced dynamic gene expression changes in vivo are prognostic in ovarian cancer,"Koussounadis A, Langdon SP, Harrison DJ, Smith VA.",Br J Cancer. 2014 Jun 10;110(12):2975-84. doi: 10.1038/bjc.2014.258. Epub 2014 May 27.,Koussounadis A,Br J Cancer,2014,2014/05/29,PMC4056064,,10.1038/bjc.2014.258,1
23442824,"quantifying the contribution of chromatin dynamics to stochastic gene expression reveals long, locus-dependent periods between transcriptional bursts","Viñuelas J, Kaneko G, Coulon A, Vallin E, Morin V, Mejia-Pous C, Kupiec JJ, Beslon G, Gandrillon O.",BMC Biol. 2013 Feb 25;11:15. doi: 10.1186/1741-7007-11-15.,Viñuelas J,BMC Biol,2013,2013/02/28,PMC3635915,,10.1186/1741-7007-11-15,0
35175937,temporal transcriptomic analysis using trendcatcher identifies early and persistent neutrophil activation in severe covid-19,"Wang X, Sanborn MA, Dai Y, Rehman J.",JCI Insight. 2022 Feb 17:e157255. doi: 10.1172/jci.insight.157255. Online ahead of print.,Wang X,JCI Insight,2022,2022/02/17,,,10.1172/jci.insight.157255,1
26658111,application of gene expression trajectories initiated from erbb receptor activation highlights the dynamics of divergent promoter usage,"Carbajo D, Magi S, Itoh M, Kawaji H, Lassmann T, Arner E, Forrest AR, Carninci P, Hayashizaki Y, Daub CO; FANTOM consortium, Okada-Hatakeyama M, Mar JC.",PLoS One. 2015 Dec 14;10(12):e0144176. doi: 10.1371/journal.pone.0144176. eCollection 2015.,Carbajo D,PLoS One,2015,2015/12/15,PMC4682858,,10.1371/journal.pone.0144176,0
22817891,transcript dynamics of proinflammatory genes revealed by sequence analysis of subcellular rna fractions,"Bhatt DM, Pandya-Jones A, Tong AJ, Barozzi I, Lissner MM, Natoli G, Black DL, Smale ST.",Cell. 2012 Jul 20;150(2):279-90. doi: 10.1016/j.cell.2012.05.043.,Bhatt DM,Cell,2012,2012/07/24,PMC3405548,NIHMS390359,10.1016/j.cell.2012.05.043,1
22099593,dynamics of short-term gene expression profiling in liver following thermal injury,"Yang Q, Orman MA, Berthiaume F, Ierapetritou MG, Androulakis IP.",J Surg Res. 2012 Aug;176(2):549-58. doi: 10.1016/j.jss.2011.09.052. Epub 2011 Oct 21.,Yang Q,J Surg Res,2012,2011/11/22,PMC3319855,NIHMS340914,10.1016/j.jss.2011.09.052,1
31659282,rna binding protein hud contributes to β-cell dysfunction by impairing mitochondria dynamics,"Hong Y, Tak H, Kim C, Kang H, Ji E, Ahn S, Jung M, Kim HL, Lee JH, Kim W, Lee EK.",Cell Death Differ. 2020 May;27(5):1633-1643. doi: 10.1038/s41418-019-0447-x. Epub 2019 Oct 28.,Hong Y,Cell Death Differ,2020,2019/10/30,PMC7206106,,10.1038/s41418-019-0447-x,0
33499699,elucidating the cellular dynamics of the brain with single-cell rna sequencing,"Cardona-Alberich A, Tourbez M, Pearce SF, Sibley CR.",RNA Biol. 2021 Jul;18(7):1063-1084. doi: 10.1080/15476286.2020.1870362. Epub 2021 Jan 27.,Cardona-Alberich A,RNA Biol,2021,2021/01/27,PMC8216183,,10.1080/15476286.2020.1870362,1
25274406,dynamic classification using case-specific training cohorts outperforms static gene expression signatures in breast cancer,"Győrffy B, Karn T, Sztupinszki Z, Weltz B, Müller V, Pusztai L.",Int J Cancer. 2015 May 1;136(9):2091-8. doi: 10.1002/ijc.29247. Epub 2014 Oct 11.,Győrffy B,Int J Cancer,2015,2014/10/03,PMC4354298,,10.1002/ijc.29247,1
35122624,mapping and analysis of a spatiotemporal h3k27ac and gene expression spectrum in pigs,"Zhu Y, Zhou Z, Huang T, Zhang Z, Li W, Ling Z, Jiang T, Yang J, Yang S, Xiao Y, Charlier C, Georges M, Yang B, Huang L.",Sci China Life Sci. 2022 Jan 27. doi: 10.1007/s11427-021-2034-5. Online ahead of print.,Zhu Y,Sci China Life Sci,2022,2022/02/05,,,10.1007/s11427-021-2034-5,0
30010714,physiological rna dynamics in rna-seq analysis,"Xu Z, Asakawa S.",Brief Bioinform. 2019 Sep 27;20(5):1725-1733. doi: 10.1093/bib/bby045.,Xu Z,Brief Bioinform,2019,2018/07/17,,,10.1093/bib/bby045,0
33826985,fine-scale temporal dynamics of sars-cov-2 rna abundance in wastewater during a covid-19 lockdown,"Li B, Di DYW, Saingam P, Jeon MK, Yan T.",Water Res. 2021 Jun 1;197:117093. doi: 10.1016/j.watres.2021.117093. Epub 2021 Mar 29.,Li B,Water Res,2021,2021/04/07,PMC8006545,,10.1016/j.watres.2021.117093,0
29879102,temporal precision of regulated gene expression,"Gupta S, Varennes J, Korswagen HC, Mugler A.",PLoS Comput Biol. 2018 Jun 7;14(6):e1006201. doi: 10.1371/journal.pcbi.1006201. eCollection 2018 Jun.,Gupta S,PLoS Comput Biol,2018,2018/06/08,PMC5991653,,10.1371/journal.pcbi.1006201,0
34412594,searchlight: automated bulk rna-seq exploration and visualisation using dynamically generated r scripts,"Cole JJ, Faydaci BA, McGuinness D, Shaw R, Maciewicz RA, Robertson NA, Goodyear CS.",BMC Bioinformatics. 2021 Aug 19;22(1):411. doi: 10.1186/s12859-021-04321-2.,Cole JJ,BMC Bioinformatics,2021,2021/08/20,PMC8375142,,10.1186/s12859-021-04321-2,0
34178987,spatiotemporal insights into rna-organelle interactions in neurons,"Kharod SC, Hwang DW, Das S, Yoon YJ.",Front Cell Dev Biol. 2021 Jun 10;9:663367. doi: 10.3389/fcell.2021.663367. eCollection 2021.,Kharod SC,Front Cell Dev Biol,2021,2021/06/28,PMC8222803,,10.3389/fcell.2021.663367,0
28138995,time course analysis of rna quality in placenta preserved by rnalater or flash freezing,"Martin NM, Cooke KM, Radford CC, Perley LE, Silasi M, Flannery CA.",Am J Reprod Immunol. 2017 Apr;77(4):10.1111/aji.12637. doi: 10.1111/aji.12637. Epub 2017 Jan 31.,Martin NM,Am J Reprod Immunol,2017,2017/02/01,PMC5397349,NIHMS841381,10.1111/aji.12637,0
29765399,a seasonal time-series model based on gene expression programming for predicting financial distress,"Cheng CH, Chan CP, Yang JH.",Comput Intell Neurosci. 2018 Mar 22;2018:1067350. doi: 10.1155/2018/1067350. eCollection 2018.,Cheng CH,Comput Intell Neurosci,2018,2018/05/17,PMC5885405,,10.1155/2018/1067350,0
26853282,spatio-temporal regulations and functions of neuronal alternative rna splicing in developing and adult brains,"Iijima T, Hidaka C, Iijima Y.",Neurosci Res. 2016 Aug;109:1-8. doi: 10.1016/j.neures.2016.01.010. Epub 2016 Feb 4.,Iijima T,Neurosci Res,2016,2016/02/09,,,10.1016/j.neures.2016.01.010,0
31925874,spatiotemporal control of gene expression boundaries using a feedforward loop,"Bandodkar PU, Al Asafen H, Reeves GT.",Dev Dyn. 2020 Mar;249(3):369-382. doi: 10.1002/dvdy.150. Epub 2020 Jan 23.,Bandodkar PU,Dev Dyn,2020,2020/01/12,PMC7516927,NIHMS1628372,10.1002/dvdy.150,0
33845875,a benchmark for rna-seq deconvolution analysis under dynamic testing environments,"Jin H, Liu Z.",Genome Biol. 2021 Apr 12;22(1):102. doi: 10.1186/s13059-021-02290-6.,Jin H,Genome Biol,2021,2021/04/13,PMC8042713,,10.1186/s13059-021-02290-6,0
32541043,regulation of spatiotemporal limits of developmental gene expression via enhancer grammar,"Keller SH, Jena SG, Yamazaki Y, Lim B.",Proc Natl Acad Sci U S A. 2020 Jun 30;117(26):15096-15103. doi: 10.1073/pnas.1917040117. Epub 2020 Jun 15.,Keller SH,Proc Natl Acad Sci U S A,2020,2020/06/17,PMC7334449,,10.1073/pnas.1917040117,0
29349913,eukaryotic phytoplankton community spatiotemporal dynamics as identified through gene expression within a eutrophic estuary,"Gong W, Paerl H, Marchetti A.",Environ Microbiol. 2018 Mar;20(3):1095-1111. doi: 10.1111/1462-2920.14049. Epub 2018 Feb 19.,Gong W,Environ Microbiol,2018,2018/01/20,,,10.1111/1462-2920.14049,0
26235224,dynamics of gene silencing during x inactivation using allele-specific rna-seq,"Marks H, Kerstens HH, Barakat TS, Splinter E, Dirks RA, van Mierlo G, Joshi O, Wang SY, Babak T, Albers CA, Kalkan T, Smith A, Jouneau A, de Laat W, Gribnau J, Stunnenberg HG.",Genome Biol. 2015 Aug 3;16(1):149. doi: 10.1186/s13059-015-0698-x.,Marks H,Genome Biol,2015,2015/08/04,PMC4546214,,10.1186/s13059-015-0698-x,0
24830797,inference of rna polymerase ii transcription dynamics from chromatin immunoprecipitation time course data,"wa Maina C, Honkela A, Matarese F, Grote K, Stunnenberg HG, Reid G, Lawrence ND, Rattray M.",PLoS Comput Biol. 2014 May 15;10(5):e1003598. doi: 10.1371/journal.pcbi.1003598. eCollection 2014 May.,wa Maina C,PLoS Comput Biol,2014,2014/05/17,PMC4022483,,10.1371/journal.pcbi.1003598,0
22305712,synthetic rna switches as a tool for temporal and spatial control over gene expression,"Chang AL, Wolf JJ, Smolke CD.",Curr Opin Biotechnol. 2012 Oct;23(5):679-88. doi: 10.1016/j.copbio.2012.01.005. Epub 2012 Feb 3.,Chang AL,Curr Opin Biotechnol,2012,2012/02/07,PMC3354030,NIHMS355632,10.1016/j.copbio.2012.01.005,0
29045151,dynamic blue light-inducible t7 rna polymerases (opto-t7rnaps) for precise spatiotemporal gene expression control,"Baumschlager A, Aoki SK, Khammash M.",ACS Synth Biol. 2017 Nov 17;6(11):2157-2167. doi: 10.1021/acssynbio.7b00169. Epub 2017 Oct 18.,Baumschlager A,ACS Synth Biol,2017,2017/10/19,,,10.1021/acssynbio.7b00169,0
34867172,study of neuronal apoptosis cerna network in hippocampal sclerosis of human temporal lobe epilepsy by rna-seq,"Yu S, Gu Y, Wang T, Mu L, Wang H, Yan S, Wang A, Wang J, Liu L, Shen H, Na M, Lin Z.",Front Neurosci. 2021 Nov 12;15:770627. doi: 10.3389/fnins.2021.770627. eCollection 2021.,Yu S,Front Neurosci,2021,2021/12/06,PMC8633546,,10.3389/fnins.2021.770627,0
26541409,spatio-temporal regulation of circular rna expression during porcine embryonic brain development,"Venø MT, Hansen TB, Venø ST, Clausen BH, Grebing M, Finsen B, Holm IE, Kjems J.",Genome Biol. 2015 Nov 5;16:245. doi: 10.1186/s13059-015-0801-3.,Venø MT,Genome Biol,2015,2015/11/07,PMC4635978,,10.1186/s13059-015-0801-3,0
32428200,confounding factors from inducible systems for spatiotemporal gene expression regulation,"Wüst RCI, Houtkooper RH, Auwerx J.",J Cell Biol. 2020 Jul 6;219(7):e202003031. doi: 10.1083/jcb.202003031.,Wüst RCI,J Cell Biol,2020,2020/05/20,PMC7337492,,10.1083/jcb.202003031,0
24287731,gene expression in superior temporal cortex of schizophrenia patients,"Sellmann C, Villarín Pildaín L, Schmitt A, Leonardi-Essmann F, Durrenberger PF, Spanagel R, Arzberger T, Kretzschmar H, Zink M, Gruber O, Herrera-Marschitz M, Reynolds R, Falkai P, Gebicke-Haerter PJ, Matthäus F.",Eur Arch Psychiatry Clin Neurosci. 2014 Jun;264(4):297-309. doi: 10.1007/s00406-013-0473-5. Epub 2013 Nov 28.,Sellmann C,Eur Arch Psychiatry Clin Neurosci,2014,2013/11/30,,,10.1007/s00406-013-0473-5,0
26346000,dynamic model for rna-seq data analysis,"Li L, Xiong M.",Biomed Res Int. 2015;2015:916352. doi: 10.1155/2015/916352. Epub 2015 Aug 4.,Li L,Biomed Res Int,2015,2015/09/09,PMC4539434,,10.1155/2015/916352,0
28396000,measuring signaling and rna-seq in the same cell links gene expression to dynamic patterns of nf-κb activation,"Lane K, Van Valen D, DeFelice MM, Macklin DN, Kudo T, Jaimovich A, Carr A, Meyer T, Pe'er D, Boutet SC, Covert MW.",Cell Syst. 2017 Apr 26;4(4):458-469.e5. doi: 10.1016/j.cels.2017.03.010. Epub 2017 Apr 5.,Lane K,Cell Syst,2017,2017/04/12,PMC6748049,NIHMS1046627,10.1016/j.cels.2017.03.010,0
19059393,temporal regulation of ath5 gene expression during eye development,"Willardsen MI, Suli A, Pan Y, Marsh-Armstrong N, Chien CB, El-Hodiri H, Brown NL, Moore KB, Vetter ML.",Dev Biol. 2009 Feb 15;326(2):471-81. doi: 10.1016/j.ydbio.2008.10.046. Epub 2008 Nov 14.,Willardsen MI,Dev Biol,2009,2008/12/09,PMC2788623,NIHMS95924,10.1016/j.ydbio.2008.10.046,0
24531367,spatiotemporal control of gene expression using microfluidics,"Benedetto A, Accetta G, Fujita Y, Charras G.",Lab Chip. 2014 Apr 7;14(7):1336-47. doi: 10.1039/c3lc51281a.,Benedetto A,Lab Chip,2014,2014/02/18,,,10.1039/c3lc51281a,0
28028473,spatio-temporal monitoring of deep-sea communities using metabarcoding of sediment dna and rna,"Guardiola M, Wangensteen OS, Taberlet P, Coissac E, Uriz MJ, Turon X.",PeerJ. 2016 Dec 21;4:e2807. doi: 10.7717/peerj.2807. eCollection 2016.,Guardiola M,PeerJ,2016,2016/12/29,PMC5180584,,10.7717/peerj.2807,0
25660377,temporal dynamics of intrahost molecular evolution for a plant rna virus,"Cuevas JM, Willemsen A, Hillung J, Zwart MP, Elena SF.",Mol Biol Evol. 2015 May;32(5):1132-47. doi: 10.1093/molbev/msv028. Epub 2015 Feb 6.,Cuevas JM,Mol Biol Evol,2015,2015/02/10,,,10.1093/molbev/msv028,0
27184660,a 17-month time course study of human rna and dna degradation in body fluids under dry and humid environmental conditions,"Sirker M, Schneider PM, Gomes I.",Int J Legal Med. 2016 Nov;130(6):1431-1438. doi: 10.1007/s00414-016-1373-9. Epub 2016 May 16.,Sirker M,Int J Legal Med,2016,2016/05/18,,,10.1007/s00414-016-1373-9,0
17174950,a time course study demonstrating rna stability in postmortem skin,"Gopee NV, Howard PC.",Exp Mol Pathol. 2007 Aug;83(1):4-10. doi: 10.1016/j.yexmp.2006.11.001. Epub 2006 Dec 18.,Gopee NV,Exp Mol Pathol,2007,2006/12/19,,,10.1016/j.yexmp.2006.11.001,0
32825128,the regulatory network of cmpg1-v in wheat-blumeria graminis f. sp. tritici interaction revealed by temporal profiling using rna-seq,"Liu J, Sun L, Chen Y, Wei L, Hao Y, Yu Z, Wang Z, Zhang H, Zhang X, Li M, Wang H, Xiao J, Wang X.",Int J Mol Sci. 2020 Aug 19;21(17):5967. doi: 10.3390/ijms21175967.,Liu J,Int J Mol Sci,2020,2020/08/23,PMC7504233,,10.3390/ijms21175967,0
19805311,spatiotemporal patterns and transcription kinetics of induced rna in single bacterial cells,"Valencia-Burton M, Shah A, Sutin J, Borogovac A, McCullough RM, Cantor CR, Meller A, Broude NE.",Proc Natl Acad Sci U S A. 2009 Sep 22;106(38):16399-404. doi: 10.1073/pnas.0907495106. Epub 2009 Sep 11.,Valencia-Burton M,Proc Natl Acad Sci U S A,2009,2009/10/07,PMC2752509,,10.1073/pnas.0907495106,0
25446321,"transcriptomic analysis across nasal, temporal, and macular regions of human neural retina and rpe/choroid by rna-seq","Whitmore SS, Wagner AH, DeLuca AP, Drack AV, Stone EM, Tucker BA, Zeng S, Braun TA, Mullins RF, Scheetz TE.",Exp Eye Res. 2014 Dec;129:93-106. doi: 10.1016/j.exer.2014.11.001. Epub 2014 Nov 5.,Whitmore SS,Exp Eye Res,2014,2014/12/03,PMC4259842,NIHMS640738,10.1016/j.exer.2014.11.001,0
34582878,associations between sars-cov-2 rna concentrations in wastewater and covid-19 rates in days after sampling in small urban areas of seville: a time series study,"Rodríguez Rasero FJ, Moya Ruano LA, Rasero Del Real P, Cuberos Gómez L, Lorusso N.",Sci Total Environ. 2022 Feb 1;806(Pt 1):150573. doi: 10.1016/j.scitotenv.2021.150573. Epub 2021 Sep 25.,Rodríguez Rasero FJ,Sci Total Environ,2022,2021/09/28,PMC8464400,,10.1016/j.scitotenv.2021.150573,0
23383374,the spatio-temporal distribution dynamics of ebola virus proteins and rna in infected cells,"Nanbo A, Watanabe S, Halfmann P, Kawaoka Y.",Sci Rep. 2013;3:1206. doi: 10.1038/srep01206. Epub 2013 Feb 4.,Nanbo A,Sci Rep,2013,2013/02/06,PMC3563031,,10.1038/srep01206,0
27808119,directional and reoccurring sequence change in zoonotic rna virus genomes visualized by time-series word count,"Wada Y, Wada K, Iwasaki Y, Kanaya S, Ikemura T.",Sci Rep. 2016 Nov 3;6:36197. doi: 10.1038/srep36197.,Wada Y,Sci Rep,2016,2016/11/04,PMC5093548,,10.1038/srep36197,0
19164593,"image-guided, noninvasive, spatiotemporal control of gene expression","Deckers R, Quesson B, Arsaut J, Eimer S, Couillaud F, Moonen CT.",Proc Natl Acad Sci U S A. 2009 Jan 27;106(4):1175-80. doi: 10.1073/pnas.0806936106. Epub 2009 Jan 21.,Deckers R,Proc Natl Acad Sci U S A,2009,2009/01/24,PMC2633569,,10.1073/pnas.0806936106,0
34684213,surveillance along the rio grande during the 2020 vesicular stomatitis outbreak reveals spatio-temporal dynamics of and viral rna detection in black flies,"Young KI, Valdez F, Vaquera C, Campos C, Zhou L, Vessels HK, Moulton JK, Drolet BS, Rozo-Lopez P, Pelzel-McCluskey AM, Peters DC, Rodriguez LL, Hanley KA.",Pathogens. 2021 Oct 1;10(10):1264. doi: 10.3390/pathogens10101264.,Young KI,Pathogens,2021,2021/10/23,PMC8541391,,10.3390/pathogens10101264,0
23845781,dynamic expression of 3' utrs revealed by poisson hidden markov modeling of rna-seq: implications in gene expression profiling,"Lu J, Bushel PR.",Gene. 2013 Sep 25;527(2):616-23. doi: 10.1016/j.gene.2013.06.052. Epub 2013 Jul 9.,Lu J,Gene,2013,2013/07/13,PMC3902974,NIHMS511403,10.1016/j.gene.2013.06.052,0
11835276,control of developmental timing by small temporal rnas: a paradigm for rna-mediated regulation of gene expression,"Banerjee D, Slack F.",Bioessays. 2002 Feb;24(2):119-29. doi: 10.1002/bies.10046.,Banerjee D,Bioessays,2002,2002/02/09,,,10.1002/bies.10046,0
26582006,the epitranscriptome in modulating spatiotemporal rna translation in neuronal post-synaptic function,"Hussain S, Bashir ZI.",Front Cell Neurosci. 2015 Oct 31;9:420. doi: 10.3389/fncel.2015.00420. eCollection 2015.,Hussain S,Front Cell Neurosci,2015,2015/11/20,PMC4628113,,10.3389/fncel.2015.00420,0
15805112,spatiotemporal switch from deltanp73 to tap73 isoforms during nephrogenesis: impact on differentiation gene expression,"Saifudeen Z, Diavolitsis V, Stefkova J, Dipp S, Fan H, El-Dahr SS.",J Biol Chem. 2005 Jun 17;280(24):23094-102. doi: 10.1074/jbc.M414575200. Epub 2005 Apr 1.,Saifudeen Z,J Biol Chem,2005,2005/04/05,,,10.1074/jbc.M414575200,0
26971808,contribution of hydrological data to the understanding of the spatio-temporal dynamics of f-specific rna bacteriophages in river water during rainfall-runoff events,"Fauvel B, Cauchie HM, Gantzer C, Ogorzaly L.",Water Res. 2016 May 1;94:328-340. doi: 10.1016/j.watres.2016.02.057. Epub 2016 Mar 3.,Fauvel B,Water Res,2016,2016/03/15,,,10.1016/j.watres.2016.02.057,0
23824284,dissecting the characteristics and dynamics of human protein complexes at transcriptome cascade using rna-seq data,"Chen G, Chen J, Shi C, Shi L, Tong W, Shi T.",PLoS One. 2013 Jun 18;8(6):e66521. doi: 10.1371/journal.pone.0066521. Print 2013.,Chen G,PLoS One,2013,2013/07/05,PMC3688907,,10.1371/journal.pone.0066521,0
24495318,unmixing of fluorescence spectra to resolve quantitative time-series measurements of gene expression in plate readers,"Lichten CA, White R, Clark IB, Swain PS.",BMC Biotechnol. 2014 Feb 3;14:11. doi: 10.1186/1472-6750-14-11.,Lichten CA,BMC Biotechnol,2014,2014/02/06,PMC3917901,,10.1186/1472-6750-14-11,0
21924162,spatiotemporal control of embryonic gene expression using caged morpholinos,"Shestopalov IA, Chen JK.",Methods Cell Biol. 2011;104:151-72. doi: 10.1016/B978-0-12-374814-0.00009-4.,Shestopalov IA,Methods Cell Biol,2011,2011/09/20,PMC4408312,NIHMS680285,10.1016/B978-0-12-374814-0.00009-4,0
15351232,rna degradation in human breast tissue after surgical removal: a time-course study,"Ohashi Y, Creek KE, Pirisi L, Kalus R, Young SR.",Exp Mol Pathol. 2004 Oct;77(2):98-103. doi: 10.1016/j.yexmp.2004.05.005.,Ohashi Y,Exp Mol Pathol,2004,2004/09/08,,,10.1016/j.yexmp.2004.05.005,0
19763256,a modified consumer inkjet for spatiotemporal control of gene expression,"Cohen DJ, Morfino RC, Maharbiz MM.",PLoS One. 2009 Sep 18;4(9):e7086. doi: 10.1371/journal.pone.0007086.,Cohen DJ,PLoS One,2009,2009/09/19,PMC2739290,,10.1371/journal.pone.0007086,0
16689727,amplification of low quantity bacterial rna for microarray studies: time-course analysis of leptospirillum ferrooxidans under nitrogen-fixing conditions,"Moreno-Paz M, Parro V.",Environ Microbiol. 2006 Jun;8(6):1064-73. doi: 10.1111/j.1462-2920.2006.00998.x.,Moreno-Paz M,Environ Microbiol,2006,2006/05/13,,,10.1111/j.1462-2920.2006.00998.x,0
23828545,the arabidopsis thaliana myb60 promoter provides a tool for the spatio-temporal control of gene expression in stomatal guard cells,"Rusconi F, Simeoni F, Francia P, Cominelli E, Conti L, Riboni M, Simoni L, Martin CR, Tonelli C, Galbiati M.",J Exp Bot. 2013 Aug;64(11):3361-71. doi: 10.1093/jxb/ert180. Epub 2013 Jul 4.,Rusconi F,J Exp Bot,2013,2013/07/06,PMC3733157,,10.1093/jxb/ert180,0
12656550,"time course of early induction of intracellular adhesion molecule-1 messenger rna during reperfusion, following cardiopulmonary bypass with hypothermic circulatory arrest in lambs","Tabbutt S, Newburger JW, Hickey PR, Mayer JE, Neufeld EJ.",Pediatr Crit Care Med. 2003 Jan;4(1):83-8. doi: 10.1097/00130478-200301000-00017.,Tabbutt S,Pediatr Crit Care Med,2003,2003/03/27,,,10.1097/00130478-200301000-00017,0
24025532,spatio-temporal profiling of filamin a rna-editing reveals adar preferences and high editing levels outside neuronal tissues,"Stulić M, Jantsch MF.",RNA Biol. 2013 Oct;10(10):1611-7. doi: 10.4161/rna.26216. Epub 2013 Sep 4.,Stulić M,RNA Biol,2013,2013/09/13,PMC3866242,,10.4161/rna.26216,0
19700494,"an inducible, modular system for spatio-temporal control of gene expression in stomatal guard cells","Xiong TC, Hann CM, Chambers JP, Surget M, Ng CK.",J Exp Bot. 2009;60(14):4129-36. doi: 10.1093/jxb/erp246. Epub 2009 Aug 21.,Xiong TC,J Exp Bot,2009,2009/08/25,PMC2755031,,10.1093/jxb/erp246,0
22426501,spatiotemporal behavior of nuclear cyclophilin b indicates a role in rna transcription,"Dieriks B, Van Oostveldt P.",Int J Mol Med. 2012 Jun;29(6):1031-8. doi: 10.3892/ijmm.2012.937. Epub 2012 Mar 13.,Dieriks B,Int J Mol Med,2012,2012/03/20,,,10.3892/ijmm.2012.937,0
12351170,spatial and temporal 'knock down' of gene expression by electroporation of double-stranded rna and morpholinos into early postimplantation mouse embryos,"Mellitzer G, Hallonet M, Chen L, Ang SL.",Mech Dev. 2002 Oct;118(1-2):57-63. doi: 10.1016/s0925-4773(02)00191-0.,Mellitzer G,Mech Dev,2002,2002/09/28,,,10.1016/s0925-4773(02)00191-0,0
12903310,measurement of the time course of dna/rna hybridization and rna detection using fluorescence polarization analysis,"Kido C, Tsuruoka M.",Nucleic Acids Symp Ser. 2000;(44):145-6. doi: 10.1093/nass/44.1.145.,Kido C,Nucleic Acids Symp Ser,2000,2003/08/09,,,10.1093/nass/44.1.145,0
26850229,erratum to: dynamics of gene silencing during x inactivation using allele-specific rna-seq,"Marks H, Kerstens HH, Barakat TS, Splinter E, Dirks RA, van Mierlo G, Joshi O, Wang SY, Babak T, Albers CA, Kalkan T, Smith A, Jouneau A, de Laat W, Gribnau J, Stunnenberg HG.",Genome Biol. 2016 Feb 5;17:22. doi: 10.1186/s13059-016-0885-4.,Marks H,Genome Biol,2016,2016/02/07,PMC4743200,,10.1186/s13059-016-0885-4,0
19749323,development of light-responsive bna toward the spatiotemporal control of gene expression,"Morihiro K, Kodama T, Nishida M, Imanishi T, Obika S.",Nucleic Acids Symp Ser (Oxf). 2009;(53):187-8. doi: 10.1093/nass/nrp094.,Morihiro K,Nucleic Acids Symp Ser (Oxf),2009,2009/09/15,,,10.1093/nass/nrp094,0
18265885,gene expression in temporal lobe epilepsy,Janigro D.,Epilepsy Curr. 2008 Jan-Feb;8(1):23-4. doi: 10.1111/j.1535-7511.2007.00223.x.,Janigro D,Epilepsy Curr,2008,2008/02/13,PMC2238643,,10.1111/j.1535-7511.2007.00223.x,0
32034313,spatio-temporal characterization of the antiviral activity of the xrn1-dcp1/2 aggregation against cytoplasmic rna viruses to prevent cell death,"Ng CS, Kasumba DM, Fujita T, Luo H.",Cell Death Differ. 2020 Aug;27(8):2363-2382. doi: 10.1038/s41418-020-0509-0. Epub 2020 Feb 7.,Ng CS,Cell Death Differ,2020,2020/02/09,PMC7370233,,10.1038/s41418-020-0509-0,0
15096621,spatiotemporal control of gene expression with pulse-generating networks,"Basu S, Mehreja R, Thiberge S, Chen MT, Weiss R.",Proc Natl Acad Sci U S A. 2004 Apr 27;101(17):6355-60. doi: 10.1073/pnas.0307571101. Epub 2004 Apr 19.,Basu S,Proc Natl Acad Sci U S A,2004,2004/04/21,PMC404049,,10.1073/pnas.0307571101,0
17404370,gene expression profile in temporal lobe epilepsy,"Aronica E, Gorter JA.",Neuroscientist. 2007 Apr;13(2):100-8. doi: 10.1177/1073858406295832.,Aronica E,Neuroscientist,2007,2007/04/04,,,10.1177/1073858406295832,0
23607937,differences between rna and dna due to rna editing in temporal lobe epilepsy,"Krestel H, Raffel S, von Lehe M, Jagella C, Moskau-Hartmann S, Becker A, Elger CE, Seeburg PH, Nirkko A.",Neurobiol Dis. 2013 Aug;56:66-73. doi: 10.1016/j.nbd.2013.04.006. Epub 2013 Apr 20.,Krestel H,Neurobiol Dis,2013,2013/04/24,,,10.1016/j.nbd.2013.04.006,0
11461923,temporal translational control by a metastable rna structure,"Møller-Jensen J, Franch T, Gerdes K.",J Biol Chem. 2001 Sep 21;276(38):35707-13. doi: 10.1074/jbc.M105347200. Epub 2001 Jul 18.,Møller-Jensen J,J Biol Chem,2001,2001/07/20,,,10.1074/jbc.M105347200,0
