PMID,Title,Authors,Citation,First Author,Journal/Book,Publication Year,Create Date,PMCID,NIHMS ID,DOI,Label
32661592,comprehensive temporal reprogramming ensures dynamicity of transcriptomic profile for adaptive response in taxus contorta,"Majeed A, Singh A, Sharma RK, Jaitak V, Bhardwaj P.",Mol Genet Genomics. 2020 Nov;295(6):1401-1414. doi: 10.1007/s00438-020-01709-2. Epub 2020 Jul 13.,Majeed A,Mol Genet Genomics,2020,2020/07/15,,,10.1007/s00438-020-01709-2,1
24178032,a pathogenic non-coding rna induces changes in dynamic dna methylation of ribosomal rna genes in host plants,"Martinez G, Castellano M, Tortosa M, Pallas V, Gomez G.",Nucleic Acids Res. 2014 Feb;42(3):1553-62. doi: 10.1093/nar/gkt968. Epub 2013 Oct 30.,Martinez G,Nucleic Acids Res,2014,2013/11/02,PMC3919566,,10.1093/nar/gkt968,0
29246860,dynamic patterns of gene expression during leaf initiation,"Yu T, Guan C, Wang J, Sajjad M, Ma L, Jiao Y.",J Genet Genomics. 2017 Dec 20;44(12):599-601. doi: 10.1016/j.jgg.2017.11.001. Epub 2017 Nov 13.,Yu T,J Genet Genomics,2017,2017/12/17,,,10.1016/j.jgg.2017.11.001,1
33167867,temporal transcriptomic differences between tolerant and susceptible genotypes contribute to rice drought tolerance,"Xia H, Ma X, Xu K, Wang L, Liu H, Chen L, Luo L.",BMC Genomics. 2020 Nov 10;21(1):776. doi: 10.1186/s12864-020-07193-7.,Xia H,BMC Genomics,2020,2020/11/10,PMC7654621,,10.1186/s12864-020-07193-7,1
30923229,dynamics of gene expression in single root cells of arabidopsis thaliana,"Jean-Baptiste K, McFaline-Figueroa JL, Alexandre CM, Dorrity MW, Saunders L, Bubb KL, Trapnell C, Fields S, Queitsch C, Cuperus JT.",Plant Cell. 2019 May;31(5):993-1011. doi: 10.1105/tpc.18.00785. Epub 2019 Mar 28.,Jean-Baptiste K,Plant Cell,2019,2019/03/30,PMC8516002,,10.1105/tpc.18.00785,1
28294342,resolution of deep eudicot phylogeny and their temporal diversification using nuclear genes from transcriptomic and genomic datasets,"Zeng L, Zhang N, Zhang Q, Endress PK, Huang J, Ma H.",New Phytol. 2017 May;214(3):1338-1354. doi: 10.1111/nph.14503. Epub 2017 Mar 14.,Zeng L,New Phytol,2017,2017/03/16,,,10.1111/nph.14503,1
28826479,temporal network analysis identifies early physiological and transcriptomic indicators of mild drought in brassica rapa,"Greenham K, Guadagno CR, Gehan MA, Mockler TC, Weinig C, Ewers BE, McClung CR.",Elife. 2017 Aug 18;6:e29655. doi: 10.7554/eLife.29655.,Greenham K,Elife,2017,2017/08/23,PMC5628015,,10.7554/eLife.29655,1
31273443,cell wall dynamics and gene expression on soybean embryonic axes during germination,"Sangi S, Santos MLC, Alexandrino CR, Da Cunha M, Coelho FS, Ribeiro GP, Lenz D, Ballesteros H, Hemerly AS, Venâncio TM, Oliveira AEA, Grativol C.",Planta. 2019 Oct;250(4):1325-1337. doi: 10.1007/s00425-019-03231-1. Epub 2019 Jul 4.,Sangi S,Planta,2019,2019/07/06,,,10.1007/s00425-019-03231-1,1
28649278,dynamics of gene expression during development and expansion of vegetative stem internodes of bioenergy sorghum,"Kebrom TH, McKinley B, Mullet JE.",Biotechnol Biofuels. 2017 Jun 21;10:159. doi: 10.1186/s13068-017-0848-3. eCollection 2017.,Kebrom TH,Biotechnol Biofuels,2017,2017/06/27,PMC5480195,,10.1186/s13068-017-0848-3,0
19727848,fast track in vitro mycorrhization of potato plantlets allow studies on gene expression dynamics,"Gallou A, De Jaeger N, Cranenbrouck S, Declerck S.",Mycorrhiza. 2010 Mar;20(3):201-7. doi: 10.1007/s00572-009-0270-1. Epub 2009 Sep 2.,Gallou A,Mycorrhiza,2010,2009/09/04,,,10.1007/s00572-009-0270-1,1
30593858,dynamic patterns of gene expression additivity and regulatory variation throughout maize development,"Zhou P, Hirsch CN, Briggs SP, Springer NM.",Mol Plant. 2019 Mar 4;12(3):410-425. doi: 10.1016/j.molp.2018.12.015. Epub 2018 Dec 27.,Zhou P,Mol Plant,2019,2018/12/30,,,10.1016/j.molp.2018.12.015,0
25403317,"rna-sequencing reveals early, dynamic transcriptome changes in the corollas of pollinated petunias","Broderick SR, Wijeratne S, Wijeratn AJ, Chapin LJ, Meulia T, Jones ML.",BMC Plant Biol. 2014 Nov 18;14:307. doi: 10.1186/s12870-014-0307-2.,Broderick SR,BMC Plant Biol,2014,2014/11/19,PMC4245787,,10.1186/s12870-014-0307-2,1
32338516,"longitudinal transcriptomic, proteomic, and metabolomic analysis of citrus limon response to graft inoculation by candidatus liberibacter asiaticus","Ramsey JS, Chin EL, Chavez JD, Saha S, Mischuk D, Mahoney J, Mohr J, Robison FM, Mitrovic E, Xu Y, Strickler SR, Fernandez N, Zhong X, Polek M, Godfrey KE, Giovannoni JJ, Mueller LA, Slupsky CM, Bruce JE, Heck M.",J Proteome Res. 2020 Jun 5;19(6):2247-2263. doi: 10.1021/acs.jproteome.9b00802. Epub 2020 May 12.,Ramsey JS,J Proteome Res,2020,2020/04/28,PMC7970439,NIHMS1678923,10.1021/acs.jproteome.9b00802,1
23023172,arabidopsis defense against botrytis cinerea: chronology and regulation deciphered by high-resolution temporal transcriptomic analysis,"Windram O, Madhou P, McHattie S, Hill C, Hickman R, Cooke E, Jenkins DJ, Penfold CA, Baxter L, Breeze E, Kiddle SJ, Rhodes J, Atwell S, Kliebenstein DJ, Kim YS, Stegle O, Borgwardt K, Zhang C, Tabrett A, Legaie R, Moore J, Finkenstadt B, Wild DL, Mead A, Rand D, Beynon J, Ott S, Buchanan-Wollaston V, Denby KJ.",Plant Cell. 2012 Sep;24(9):3530-57. doi: 10.1105/tpc.112.102046. Epub 2012 Sep 28.,Windram O,Plant Cell,2012,2012/10/02,PMC3480286,,10.1105/tpc.112.102046,0
33837988,dynamically probing atp-dependent rna helicase a-assisted rna structure conversion using single molecule fluorescence resonance energy transfer,"Wu C, Shan Y, Wang S, Liu F.",Protein Sci. 2021 Jun;30(6):1157-1168. doi: 10.1002/pro.4081.,Wu C,Protein Sci,2021,2021/04/10,PMC8138531,,10.1002/pro.4081,0
31470680,comparative transcriptome analysis of gene expression patterns in tomato under dynamic light conditions,"Ding J, Zhao J, Pan T, Xi L, Zhang J, Zou Z.",Genes (Basel). 2019 Aug 29;10(9):662. doi: 10.3390/genes10090662.,Ding J,Genes (Basel),2019,2019/09/01,PMC6770952,,10.3390/genes10090662,1
29116234,transcriptome dynamics revealed by a gene expression atlas of the early arabidopsis embryo,"Palovaara J, Saiga S, Wendrich JR, van 't Wout Hofland N, van Schayck JP, Hater F, Mutte S, Sjollema J, Boekschoten M, Hooiveld GJ, Weijers D.",Nat Plants. 2017 Nov;3(11):894-904. doi: 10.1038/s41477-017-0035-3. Epub 2017 Nov 6.,Palovaara J,Nat Plants,2017,2017/11/09,PMC5687563,EMS74243,10.1038/s41477-017-0035-3,1
23607313,targeted transcriptomic and metabolic profiling reveals temporal bottlenecks in the maize carotenoid pathway that may be addressed by multigene engineering,"Farré G, Maiam Rivera S, Alves R, Vilaprinyo E, Sorribas A, Canela R, Naqvi S, Sandmann G, Capell T, Zhu C, Christou P.",Plant J. 2013 Aug;75(3):441-55. doi: 10.1111/tpj.12214. Epub 2013 May 30.,Farré G,Plant J,2013,2013/04/24,,,10.1111/tpj.12214,1
21785916,spatial and temporal transcriptomic analysis of the arabidopsis thaliana-botrytis cinerea interaction,"Mulema JM, Denby KJ.",Mol Biol Rep. 2012 Apr;39(4):4039-49. doi: 10.1007/s11033-011-1185-4. Epub 2011 Jul 23.,Mulema JM,Mol Biol Rep,2012,2011/07/26,,,10.1007/s11033-011-1185-4,1
26655864,"the spatial and temporal transcriptomic landscapes of ginseng, panax ginseng c. a. meyer","Wang K, Jiang S, Sun C, Lin Y, Yin R, Wang Y, Zhang M.",Sci Rep. 2015 Dec 11;5:18283. doi: 10.1038/srep18283.,Wang K,Sci Rep,2015,2015/12/15,PMC4675998,,10.1038/srep18283,1
30421411,simultaneous profiling of dna accessibility and gene expression dynamics with atac-seq and rna-seq,"Hendrickson DG, Soifer I, Wranik BJ, Botstein D, Scott McIsaac R.",Methods Mol Biol. 2018;1819:317-333. doi: 10.1007/978-1-4939-8618-7_15.,Hendrickson DG,Methods Mol Biol,2018,2018/11/14,,,10.1007/978-1-4939-8618-7_15,1
33521856,longitudinal single-cell rna-seq of hescs-derived retinal organoids,"Wang S, Poli S, Liang X, Peng GH.",Sci China Life Sci. 2021 Oct;64(10):1661-1676. doi: 10.1007/s11427-020-1836-7. Epub 2021 Jan 27.,Wang S,Sci China Life Sci,2021,2021/02/01,,,10.1007/s11427-020-1836-7,1
34131182,inferring transcriptomic cell states and transitions only from time series transcriptome data,"Jo K, Sung I, Lee D, Jang H, Kim S.",Sci Rep. 2021 Jun 15;11(1):12566. doi: 10.1038/s41598-021-91752-9.,Jo K,Sci Rep,2021,2021/06/16,PMC8206345,,10.1038/s41598-021-91752-9,1
33566765,data perturbation and recovery of time series gene expression data,"Sarkar A, Mishra P, Kahveci T.",IEEE/ACM Trans Comput Biol Bioinform. 2021 Feb 10;PP. doi: 10.1109/TCBB.2021.3058342. Online ahead of print.,Sarkar A,IEEE/ACM Trans Comput Biol Bioinform,2021,2021/02/10,,,10.1109/TCBB.2021.3058342,1
33859552,spatiotemporal correlation of epileptiform activity and gene expression in vitro,"Schlabitz S, Monni L, Ragot A, Dipper-Wawra M, Onken J, Holtkamp M, Fidzinski P.",Front Mol Neurosci. 2021 Mar 30;14:643763. doi: 10.3389/fnmol.2021.643763. eCollection 2021.,Schlabitz S,Front Mol Neurosci,2021,2021/04/16,PMC8042243,,10.3389/fnmol.2021.643763,0
33974008,rvagene: generative modeling of gene expression time series data,"Mitra R, MacLean AL.",Bioinformatics. 2021 May 11;37(19):3252-62. doi: 10.1093/bioinformatics/btab260. Online ahead of print.,Mitra R,Bioinformatics,2021,2021/05/11,PMC8504625,,10.1093/bioinformatics/btab260,1
32324563,a convolutional deep clustering framework for gene expression time series,"Ozgul OF, Bardak B, Tan M.",IEEE/ACM Trans Comput Biol Bioinform. 2021 Nov-Dec;18(6):2198-2207. doi: 10.1109/TCBB.2020.2988985. Epub 2021 Dec 8.,Ozgul OF,IEEE/ACM Trans Comput Biol Bioinform,2021,2020/04/24,,,10.1109/TCBB.2020.2988985,1
33035668,spatio-temporal correlates of gene expression and cortical morphology across lifespan and aging,"Qiu A, Zhang H, Kennedy BK, Lee A.",Neuroimage. 2021 Jan 1;224:117426. doi: 10.1016/j.neuroimage.2020.117426. Epub 2020 Oct 6.,Qiu A,Neuroimage,2021,2020/10/09,,,10.1016/j.neuroimage.2020.117426,1
32845709,time series gene expression profiles analysis identified several potential biomarkers for sepsis,"Zhang S, Li N, Chen W, Fu Q, Liu Y.",DNA Cell Biol. 2020 Oct;39(10):1862-1871. doi: 10.1089/dna.2020.5383. Epub 2020 Aug 25.,Zhang S,DNA Cell Biol,2020,2020/08/27,,,10.1089/dna.2020.5383,1
30279702,analysis of time-series gene expression data to explore mechanisms of chemical-induced hepatic steatosis toxicity,"Aguayo-Orozco A, Bois FY, Brunak S, Taboureau O.",Front Genet. 2018 Sep 18;9:396. doi: 10.3389/fgene.2018.00396. eCollection 2018.,Aguayo-Orozco A,Front Genet,2018,2018/10/04,PMC6153316,,10.3389/fgene.2018.00396,1
32728687,"exploring transcriptional switches from pairwise, temporal and population rna-seq data using deepts","Qiu Z, Chen S, Qi Y, Liu C, Zhai J, Xie S, Ma C.",Brief Bioinform. 2021 May 20;22(3):bbaa137. doi: 10.1093/bib/bbaa137.,Qiu Z,Brief Bioinform,2021,2020/07/31,,,10.1093/bib/bbaa137,0
33780909,spatiotemporal patterns of gene expression around implanted silicon electrode arrays,"Thompson CH, Saxena A, Heelan N, Salatino J, Purcell EK.",J Neural Eng. 2021 Apr 27;18(4):10.1088/1741-2552/abf2e6. doi: 10.1088/1741-2552/abf2e6.,Thompson CH,J Neural Eng,2021,2021/03/29,PMC8650570,NIHMS1755877,10.1088/1741-2552/abf2e6,1
34213536,non-parametric modelling of temporal and spatial counts data from rna-seq experiments,"BinTayyash N, Georgaka S, John ST, Ahmed S, Boukouvalas A, Hensman J, Rattray M.",Bioinformatics. 2021 Jul 2:btab486. doi: 10.1093/bioinformatics/btab486. Online ahead of print.,BinTayyash N,Bioinformatics,2021,2021/07/02,,,10.1093/bioinformatics/btab486,1
32210454,time course analysis of large-scale gene expression in incised muscle using correspondence analysis,"Horita T, Gaballah MH, Fukuta M, Kanno S, Kato H, Takamiya M, Aoki Y.",PLoS One. 2020 Mar 25;15(3):e0230737. doi: 10.1371/journal.pone.0230737. eCollection 2020.,Horita T,PLoS One,2020,2020/03/27,PMC7094855,,10.1371/journal.pone.0230737,1
33673721,temporal dynamic methods for bulk rna-seq time series data,"Oh VS, Li RW.",Genes (Basel). 2021 Feb 27;12(3):352. doi: 10.3390/genes12030352.,Oh VS,Genes (Basel),2021,2021/03/06,PMC7997275,,10.3390/genes12030352,1
31841158,time-series single-cell rna-seq data reveal auxin fluctuation during endocycle,"Torii K, Kubota A, Araki T, Endo M.",Plant Cell Physiol. 2020 Feb 1;61(2):243-254. doi: 10.1093/pcp/pcz228.,Torii K,Plant Cell Physiol,2020,2019/12/17,,,10.1093/pcp/pcz228,1
33156855,evaluation of classification and forecasting methods on time series gene expression data,"Tripto NI, Kabir M, Bayzid MS, Rahman A.",PLoS One. 2020 Nov 6;15(11):e0241686. doi: 10.1371/journal.pone.0241686. eCollection 2020.,Tripto NI,PLoS One,2020,2020/11/06,PMC7647064,,10.1371/journal.pone.0241686,1
31038684,continuous-state hmms for modeling time-series single-cell rna-seq data,"Lin C, Bar-Joseph Z.",Bioinformatics. 2019 Nov 1;35(22):4707-4715. doi: 10.1093/bioinformatics/btz296.,Lin C,Bioinformatics,2019,2019/05/01,PMC6853676,,10.1093/bioinformatics/btz296,1
31551418,longitudinal rna-seq analysis of acute and chronic neurogenic skeletal muscle atrophy,"Ehmsen JT, Kawaguchi R, Mi R, Coppola G, Höke A.",Sci Data. 2019 Sep 24;6(1):179. doi: 10.1038/s41597-019-0185-4.,Ehmsen JT,Sci Data,2019,2019/09/26,PMC6760191,,10.1038/s41597-019-0185-4,1
28575155,dynamic-bm: multispecies dynamic bodymap database from temporal rna-seq data,"Cui Y, Chen X, Niu Y, Wang D, Luo H, Fan Z, Wang D, Wu W, Teng X, He S, Luo J, Chen R.",Brief Bioinform. 2018 Nov 27;19(6):1302-1309. doi: 10.1093/bib/bbx059.,Cui Y,Brief Bioinform,2018,2017/06/03,,,10.1093/bib/bbx059,1
34068962,differential spatio-temporal regulation of t-box gene expression by micrornas during cardiac development,"Alzein M, Lozano-Velasco E, Hernández-Torres F, García-Padilla C, Domínguez JN, Aránega A, Franco D.",J Cardiovasc Dev Dis. 2021 May 14;8(5):56. doi: 10.3390/jcdd8050056.,Alzein M,J Cardiovasc Dev Dis,2021,2021/06/02,PMC8156480,,10.3390/jcdd8050056,0
31620172,time course of changes in peripheral blood gene expression during medication treatment for major depressive disorder,"Cook IA, Congdon E, Krantz DE, Hunter AM, Coppola G, Hamilton SP, Leuchter AF.",Front Genet. 2019 Sep 18;10:870. doi: 10.3389/fgene.2019.00870. eCollection 2019.,Cook IA,Front Genet,2019,2019/10/18,PMC6760033,,10.3389/fgene.2019.00870,1
30205399,a time-series analysis of severe burned injury of skin gene expression profiles,"Xu HT, Guo JC, Liu HZ, Jin WW.",Cell Physiol Biochem. 2018;49(4):1492-1498. doi: 10.1159/000493451. Epub 2018 Sep 11.,Xu HT,Cell Physiol Biochem,2018,2018/09/12,,,10.1159/000493451,1
32903255,tempora: cell trajectory inference using time-series single-cell rna sequencing data,"Tran TN, Bader GD.",PLoS Comput Biol. 2020 Sep 9;16(9):e1008205. doi: 10.1371/journal.pcbi.1008205. eCollection 2020 Sep.,Tran TN,PLoS Comput Biol,2020,2020/09/09,PMC7505465,,10.1371/journal.pcbi.1008205,1
22805708,studying and modelling dynamic biological processes using time-series gene expression data,"Bar-Joseph Z, Gitter A, Simon I.",Nat Rev Genet. 2012 Jul 18;13(8):552-64. doi: 10.1038/nrg3244.,Bar-Joseph Z,Nat Rev Genet,2012,2012/07/19,,,10.1038/nrg3244,1
34674175,a high-throughput 3'-tag rna sequencing for large-scale time-series transcriptome studies,"Weng X, Juenger TE.",Methods Mol Biol. 2022;2398:151-172. doi: 10.1007/978-1-0716-1912-4_13.,Weng X,Methods Mol Biol,2022,2021/10/21,,,10.1007/978-1-0716-1912-4_13,1
33017228,time-course analysis of the effect of embedded metal on skeletal muscle gene expression,"Wen Y, Vechetti IJ Jr, Alimov AP, Hoffman JF, Vergara VB, Kalinich JF, McCarthy JJ, Peterson CA.",Physiol Genomics. 2020 Dec 1;52(12):575-587. doi: 10.1152/physiolgenomics.00096.2020. Epub 2020 Oct 5.,Wen Y,Physiol Genomics,2020,2020/10/05,PMC7792808,,10.1152/physiolgenomics.00096.2020,1
32480201,elucidating the time course of the transcriptomic response to photobiomodulation through gene co-expression analysis,"Benson P, Kim JY, Riveros C, Camp A, Johnstone DM.",J Photochem Photobiol B. 2020 Jul;208:111916. doi: 10.1016/j.jphotobiol.2020.111916. Epub 2020 May 22.,Benson P,J Photochem Photobiol B,2020,2020/06/02,,,10.1016/j.jphotobiol.2020.111916,1
29028903,comparative analysis of differential gene expression tools for rna sequencing time course data,"Spies D, Renz PF, Beyer TA, Ciaudo C.",Brief Bioinform. 2019 Jan 18;20(1):288-298. doi: 10.1093/bib/bbx115.,Spies D,Brief Bioinform,2019,2017/10/14,PMC6357553,,10.1093/bib/bbx115,1
28330743,temporal dynamics of immediate early gene expression during cellular consolidation of spatial memory,"Barry DN, Commins S.",Behav Brain Res. 2017 Jun 1;327:44-53. doi: 10.1016/j.bbr.2017.03.019. Epub 2017 Mar 19.,Barry DN,Behav Brain Res,2017,2017/03/24,,,10.1016/j.bbr.2017.03.019,1
34196686,cstreet: a computed cell state trajectory inference method for time-series single-cell rna sequencing data,"Zhao C, Xiu W, Hua Y, Zhang N, Zhang Y.",Bioinformatics. 2021 Jul 1:btab488. doi: 10.1093/bioinformatics/btab488. Online ahead of print.,Zhao C,Bioinformatics,2021,2021/07/01,,,10.1093/bioinformatics/btab488,1
31600242,a feature selection strategy for gene expression time series experiments with hidden markov models,"Cárdenas-Ovando RA, Fernández-Figueroa EA, Rueda-Zárate HA, Noguez J, Rangel-Escareño C.",PLoS One. 2019 Oct 10;14(10):e0223183. doi: 10.1371/journal.pone.0223183. eCollection 2019.,Cárdenas-Ovando RA,PLoS One,2019,2019/10/11,PMC6786538,,10.1371/journal.pone.0223183,1
33736614,bayesian approach for predicting responses to therapy from high-dimensional time-course gene expression profiles,"Fukushima A, Sugimoto M, Hiwa S, Hiroyasu T.",BMC Bioinformatics. 2021 Mar 18;22(1):132. doi: 10.1186/s12859-021-04052-4.,Fukushima A,BMC Bioinformatics,2021,2021/03/19,PMC7977599,,10.1186/s12859-021-04052-4,1
30936567,inferring population dynamics from single-cell rna-sequencing time series data,"Fischer DS, Fiedler AK, Kernfeld EM, Genga RMJ, Bastidas-Ponce A, Bakhti M, Lickert H, Hasenauer J, Maehr R, Theis FJ.",Nat Biotechnol. 2019 Apr;37(4):461-468. doi: 10.1038/s41587-019-0088-0. Epub 2019 Apr 1.,Fischer DS,Nat Biotechnol,2019,2019/04/03,PMC7397487,NIHMS1578456,10.1038/s41587-019-0088-0,0
27552150,"time-series interactions of gene expression, vascular growth and hemodynamics during early embryonic arterial development","Goktas S, Uslu FE, Kowalski WJ, Ermek E, Keller BB, Pekkan K.",PLoS One. 2016 Aug 23;11(8):e0161611. doi: 10.1371/journal.pone.0161611. eCollection 2016.,Goktas S,PLoS One,2016,2016/08/24,PMC4994943,,10.1371/journal.pone.0161611,1
30133320,bootstrapping time-course gene expression data for gene networks: application to gene relevance networks,"Garren JM, Kim J.",J Comput Biol. 2018 Dec;25(12):1374-1384. doi: 10.1089/cmb.2018.0029. Epub 2018 Aug 22.,Garren JM,J Comput Biol,2018,2018/08/23,,,10.1089/cmb.2018.0029,1
30423074,a boolean network inference from time-series gene expression data using a genetic algorithm,"Barman S, Kwon YK.",Bioinformatics. 2018 Sep 1;34(17):i927-i933. doi: 10.1093/bioinformatics/bty584.,Barman S,Bioinformatics,2018,2018/11/14,,,10.1093/bioinformatics/bty584,1
31553718,accurate genome-wide predictions of spatio-temporal gene expression during embryonic development,"Zhou J, Schor IE, Yao V, Theesfeld CL, Marco-Ferreres R, Tadych A, Furlong EEM, Troyanskaya OG.",PLoS Genet. 2019 Sep 25;15(9):e1008382. doi: 10.1371/journal.pgen.1008382. eCollection 2019 Sep.,Zhou J,PLoS Genet,2019,2019/09/26,PMC6779412,,10.1371/journal.pgen.1008382,1
34295011,bayesian modeling of factorial time-course data with applications to a bone aging gene expression study,"Wu J, Gupta M, Hussein AI, Gerstenfeld L.",J Appl Stat. 2021;48(10):1730-1754. doi: 10.1080/02664763.2020.1772733. Epub 2020 Jun 1.,Wu J,J Appl Stat,2021,2021/07/23,PMC8291340,NIHMS1617680,10.1080/02664763.2020.1772733,1
32391378,toward modeling context-specific emt regulatory networks using temporal single cell rna-seq data,"Ramirez D, Kohar V, Lu M.",Front Mol Biosci. 2020 Apr 23;7:54. doi: 10.3389/fmolb.2020.00054. eCollection 2020.,Ramirez D,Front Mol Biosci,2020,2020/05/12,PMC7190801,,10.3389/fmolb.2020.00054,0
31609468,spatiotemporal gene expression patterns reveal molecular relatedness between retinal laminae,"Jiang D, Burger CA, Casasent AK, Albrecht NE, Li F, Samuel MA.",J Comp Neurol. 2020 Apr 1;528(5):729-755. doi: 10.1002/cne.24784. Epub 2019 Oct 31.,Jiang D,J Comp Neurol,2020,2019/10/15,PMC7147688,NIHMS1540860,10.1002/cne.24784,1
34181549,dynamic bayesian network learning to infer sparse models from time series gene expression data,"Ajmal HBE, Madden MG.",IEEE/ACM Trans Comput Biol Bioinform. 2021 Jun 28;PP. doi: 10.1109/TCBB.2021.3092879. Online ahead of print.,Ajmal HBE,IEEE/ACM Trans Comput Biol Bioinform,2021,2021/06/28,,,10.1109/TCBB.2021.3092879,1
27792272,spatiotemporal differences in otoconial gene expression,"Xu Y, Zhang Y, Lundberg YW.",Genesis. 2016 Dec;54(12):613-625. doi: 10.1002/dvg.22990. Epub 2016 Nov 12.,Xu Y,Genesis,2016,2016/10/30,PMC5914167,NIHMS827191,10.1002/dvg.22990,1
32176523,imaging of dna and rna in living eukaryotic cells to reveal spatiotemporal dynamics of gene expression,"Sato H, Das S, Singer RH, Vera M.",Annu Rev Biochem. 2020 Jun 20;89:159-187. doi: 10.1146/annurev-biochem-011520-104955. Epub 2020 Mar 16.,Sato H,Annu Rev Biochem,2020,2020/03/17,PMC7608990,NIHMS1632281,10.1146/annurev-biochem-011520-104955,0
34617037,transcriptomic profiling of experimental arterial injury reveals new mechanisms and temporal dynamics in vascular healing response,"Röhl S, Rykaczewska U, Seime T, Suur BE, Diez MG, Gådin JR, Gainullina A, Sergushichev AA, Wirka R, Lengquist M, Kronqvist M, Bergman O, Odeberg J, Lindeman JHN, Quertermous T, Hamsten A, Eriksson P, Hedin U, Razuvaev A, Matic LP.",JVS Vasc Sci. 2020 Feb 7;1:13-27. doi: 10.1016/j.jvssci.2020.01.001. eCollection 2020.,Röhl S,JVS Vasc Sci,2020,2021/10/07,PMC8489224,,10.1016/j.jvssci.2020.01.001,1
34271172,a novel approach for the analysis of time-course gene expression data based on computing with words,Rowhanimanesh A.,J Biomed Inform. 2021 Aug;120:103868. doi: 10.1016/j.jbi.2021.103868. Epub 2021 Jul 14.,Rowhanimanesh A,J Biomed Inform,2021,2021/07/16,,,10.1016/j.jbi.2021.103868,1
23826199,the time course of gene expression during reactive gliosis in the optic nerve,"Qu J, Jakobs TC.",PLoS One. 2013 Jun 27;8(6):e67094. doi: 10.1371/journal.pone.0067094. Print 2013.,Qu J,PLoS One,2013,2013/07/05,PMC3694957,,10.1371/journal.pone.0067094,1
21605425,time series gene expression profiling and temporal regulatory pathway analysis of bmp6 induced osteoblast differentiation and mineralization,"Luo W, Friedman MS, Hankenson KD, Woolf PJ.",BMC Syst Biol. 2011 May 23;5:82. doi: 10.1186/1752-0509-5-82.,Luo W,BMC Syst Biol,2011,2011/05/25,PMC3126716,,10.1186/1752-0509-5-82,0
34136104,a computational workflow for the detection of candidate diagnostic biomarkers of kawasaki disease using time-series gene expression data,"Pezoulas VC, Papaloukas C, Veyssiere M, Goules A, Tzioufas AG, Soumelis V, Fotiadis DI.",Comput Struct Biotechnol J. 2021 May 24;19:3058-3068. doi: 10.1016/j.csbj.2021.05.036. eCollection 2021.,Pezoulas VC,Comput Struct Biotechnol J,2021,2021/06/17,PMC8178098,,10.1016/j.csbj.2021.05.036,1
33744971,regulator-dependent temporal dynamics of a restriction-modification system's gene expression upon entering new host cells: single-cell and population studies,"Negri A, Werbowy O, Wons E, Dersch S, Hinrichs R, Graumann PL, Mruk I.",Nucleic Acids Res. 2021 Apr 19;49(7):3826-3840. doi: 10.1093/nar/gkab183.,Negri A,Nucleic Acids Res,2021,2021/03/21,PMC8053105,,10.1093/nar/gkab183,0
15130923,analyzing time series gene expression data,Bar-Joseph Z.,Bioinformatics. 2004 Nov 1;20(16):2493-503. doi: 10.1093/bioinformatics/bth283. Epub 2004 May 6.,Bar-Joseph Z,Bioinformatics,2004,2004/05/08,,,10.1093/bioinformatics/bth283,1
29149186,cell cycle time series gene expression data encoded as cyclic attractors in hopfield systems,"Szedlak A, Sims S, Smith N, Paternostro G, Piermarocchi C.",PLoS Comput Biol. 2017 Nov 17;13(11):e1005849. doi: 10.1371/journal.pcbi.1005849. eCollection 2017 Nov.,Szedlak A,PLoS Comput Biol,2017,2017/11/18,PMC5711035,,10.1371/journal.pcbi.1005849,1
33170265,spatio-temporal regulation of gene expression defines subpopulations of epidermal stem cells,"Aruketty M, Kurinna S.",Biochem Soc Trans. 2020 Dec 18;48(6):2839-2850. doi: 10.1042/BST20200740.,Aruketty M,Biochem Soc Trans,2020,2020/11/10,,,10.1042/BST20200740,0
33359226,high-speed parameter search of dynamic biological pathways from time-course transcriptomic profiles using high-level petri net,"Li C, Qin J, Kuroyanagi K, Lu L, Nagasaki M, Satoru M.",Biosystems. 2021 Mar;201:104332. doi: 10.1016/j.biosystems.2020.104332. Epub 2021 Jan 1.,Li C,Biosystems,2021,2020/12/28,,,10.1016/j.biosystems.2020.104332,1
30051742,inference of gene networks from gene expression time series using recurrent neural networks and sparse map estimation,Chen CK.,J Bioinform Comput Biol. 2018 Aug;16(4):1850009. doi: 10.1142/S0219720018500099. Epub 2018 Apr 26.,Chen CK,J Bioinform Comput Biol,2018,2018/07/28,,,10.1142/S0219720018500099,1
27013928,time course analysis based on gene expression profile and identification of target molecules for colorectal cancer,"Chen G, Han N, Li G, Li X, Li G, Li Z, Li Q.",Cancer Cell Int. 2016 Mar 24;16:22. doi: 10.1186/s12935-016-0296-3. eCollection 2016.,Chen G,Cancer Cell Int,2016,2016/03/26,PMC4806509,,10.1186/s12935-016-0296-3,1
33247935,an informatics research platform to make public gene expression time-course datasets reusable for more scientific discoveries,"Patra BG, Soltanalizadeh B, Deng N, Wu L, Maroufy V, Wu C, Zheng WJ, Roberts K, Wu H, Yaseen A.",Database (Oxford). 2020 Nov 28;2020:baaa074. doi: 10.1093/database/baaa074.,Patra BG,Database (Oxford),2020,2020/11/28,PMC7698665,,10.1093/database/baaa074,1
